Column1,title,publishedAt,url,content,vader_neg,vader_neu,vader_pos,vader_comp,vader_label,label,include,relevant
1,Key remarks from Russian c.bank governor after rate decision - Reuters,2022-02-11T12:26:00Z,https://www.reuters.com/markets/currencies/key-remarks-russian-cbank-governor-after-rate-decision-2022-02-11/,"MOSCOW, Feb 11 (Reuters) - The Russian Central Bank Governor Elvira Nabiullina spoke at an online press conference after the central bank raised its key rate to 9.5% on Friday. read more 
Nabiullina… [+1447 chars]",0,1,0,0,0,0,1,0
2,LIVE MARKETS Forex: worrying about an inverted yield curve - Reuters,2022-02-18T12:33:00Z,https://www.reuters.com/markets/stocks/live-markets-forex-worrying-about-an-inverted-yield-curve-2022-02-18/,"Feb 18 - Welcome to the home for real-time coverage of markets brought to you by Reuters reporters. You can share your thoughts with us at markets.research@thomsonreuters.com
FOREX: WORRYING ABOUT A… [+6636 chars]",0.211,0.789,0,-0.34,-1,-1,1,1
3,"Dollar takes a break from this week's slide ahead of BoE, ECB meetings - Reuters",2022-02-03T02:18:00Z,https://www.reuters.com/markets/europe/dollar-takes-break-this-weeks-slide-ahead-boe-ecb-meetings-2022-02-03/,"SINGAPORE, Feb 3 (Reuters) - The dollar found a footing in Asia on Thursday, pausing the week's slide as a slump in tech and social media stocks soured appetite for riskier currencies, and as traders… [+2342 chars]",0,1,0,0,0,-1,1,1
4,Euro bounce pauses ahead of U.S. inflation - Reuters,2022-02-08T01:16:00Z,https://www.reuters.com/business/euro-bounce-pauses-ahead-us-inflation-2022-02-08/,"SINGAPORE, Feb 8 (Reuters) - A resurgent euro was hunkered just short of strong resistance levels on Tuesday as traders awaited U.S. inflation data due later in the week, wary it could trigger gains … [+2123 chars]",0,1,0,0,0,1,1,1
5,"Dollar near two-week high amid jitters over hawkish Fed, Ukraine tensions - Reuters",2022-01-25T01:52:00Z,https://www.reuters.com/markets/europe/dollar-near-two-week-high-amid-jitters-over-hawkish-fed-ukraine-tensions-2022-01-25/,"TOKYO, Jan 25 (Reuters) - The safe-haven U.S. dollar hovered near a two-week high against its major peers on Tuesday amid escalating worries about both a faster pace of Federal Reserve policy tighten… [+3540 chars]",0.197,0.803,0,-0.4019,-1,-1,1,1
6,Dollar finds buyers as Fed flags hikes - Reuters,2022-01-27T00:15:00Z,https://www.reuters.com/markets/europe/dollar-finds-buyers-fed-flags-hikes-2022-01-27/,"SINGAPORE, Jan 27 (Reuters) - The dollar was perched near a five-week high on Thursday, bolstered after Federal Reserve chair Jerome Powell primed investors for U.S. interest rate hikes beginning in … [+2387 chars]",0,1,0,0,0,1,1,1
7,UPDATE 4-Bitcoin bounces off six month lows as buyers step in - Reuters.com,2022-01-24T21:26:00Z,https://www.reuters.com/article/fintech-crypto-idUSL1N2U42JD,"(Recasts with price change, adds quotes, technical levels, updates prices)
NEW YORK/LONDON, Jan 24 (Reuters) - Bitcoin gained on the day on Monday as buyers stepped in to buy the cryptocurrency, aft… [+2394 chars]",0.141,0.859,0,-0.2023,-1,-1,1,0
8,Bitcoin skids to six-month low as fears over Ukraine shake markets - Reuters,2022-01-24T17:11:00Z,https://www.reuters.com/business/bitcoin-skids-six-month-low-fears-over-ukraine-shake-markets-2022-01-24/,"LONDON/NEW YORK, Jan 24 (Reuters) - Bitcoin tumbled to its lowest level in six months on Monday as fears of a Russian attack on Ukraine saw riskier assets worldwide extend their sell-off.
The larges… [+2280 chars]",0.423,0.577,0,-0.6808,-1,-1,1,0
9,Ukraine stand-off keeps euro pinned - Reuters,2022-02-17T01:04:00Z,https://www.reuters.com/business/ukraine-stand-off-keeps-euro-pinned-2022-02-17/,"SINGAPORE, Feb 17 (Reuters) - The euro was weighed down on Thursday after a U.S. official said Russia was increasing troop numbers near its border with Ukraine rather than withdrawing, offsetting a b… [+2860 chars]",0,1,0,0,0,-1,1,1
10,Bitcoin falls to six-month low as fears of Ukraine conflict shake markets - The Globe and Mail,2022-01-24T13:07:51Z,https://www.theglobeandmail.com/business/international-business/article-bitcoin-falls-to-six-month-low-as-fears-of-ukraine-conflict-shake/,"Bitcoin BTF22 tumbled to its lowest level in six months on Monday as fears of a Russian attack on Ukraine saw riskier assets worldwide extend their sell-off.
The largest cryptocurrency was last down… [+2059 chars]",0.426,0.574,0,-0.7845,-1,-1,1,0
11,"Hawkish Fed bets, Russia-Ukraine tensions weigh heavily - Reuters",2022-01-24T09:15:00Z,https://www.reuters.com/markets/europe/hawkish-fed-bets-russia-ukraine-tensions-weigh-heavily-2022-01-24/,"Jan 24 (Reuters) - Emerging market shares fell sharply on Monday in anticipation of a hawkish U.S. Federal Reserve this week, while Russia's volatile rouble steadied at nine-month lows with the West … [+3227 chars]",0.278,0.722,0,-0.4019,-1,-1,1,1
12,Dollar hits one-month high to yen as U.S. yields rise - Reuters,2022-02-09T02:14:00Z,https://www.reuters.com/markets/europe/dollar-hits-one-month-high-yen-us-yields-rise-2022-02-09/,"TOKYO, Feb 9 (Reuters) - The dollar touched a one-month high versus the yen on Wednesday, boosted by a climb in Treasury yields to multi-year peaks overnight as traders wait on U.S. inflation data th… [+2747 chars]",0,1,0,0,0,1,1,1
13,"EMERGING MARKETS-Latam currencies boosted by commodities, end January stronger - Reuters.com",2022-01-31T19:27:00Z,https://www.reuters.com/article/emerging-markets-latam-idUSL1N2UB1X9,"* Chile's peso best performer in Jan
 * Mexico's peso lags peers this month
 * IMF sees regional inflation expectations as anchored 
(Adds details, updates prices)
 By Shreyashi Sanyal and Ambar … [+3150 chars]",0,0.611,0.389,0.6249,1,1,1,1
14,Bitcoin bounces off six month lows as buyers step in - Reuters,2022-01-24T21:24:00Z,https://www.reuters.com/markets/europe/bitcoin-bounces-off-six-month-lows-buyers-step-2022-01-24/,"NEW YORK/LONDON, Jan 24 (Reuters) - Bitcoin gained on the day on Monday as buyers stepped in to buy the cryptocurrency, after earlier tumbling to its lowest level in six months on fears of a Russian … [+2663 chars]",0.153,0.847,0,-0.2023,-1,-1,1,1
15,"Cryptocurrencies pause after weekend battering, other currencies wait for Fed - Reuters",2022-01-24T00:54:00Z,https://www.reuters.com/markets/europe/cryptocurrencies-pause-after-weekend-battering-other-currencies-wait-fed-2022-01-24/,"HONG KONG, Jan 24 (Reuters) - The dollar traded steady on Monday ahead of the U.S. Federal Reserve's January policy meeting later this week, while bitcoin lay bruised near a six-month low hit over th… [+3357 chars]",0,1,0,0,0,0,1,1
16,Rate hike bets keep U.S. dollar bid - Reuters,2022-02-11T02:01:00Z,https://www.reuters.com/business/rate-hike-bets-keep-us-dollar-bid-2022-02-11/,"SINGAPORE, Feb 11 (Reuters) - The dollar was firm in Asia on Friday after hotter-than-expected U.S. inflation and hawkish comments from a Federal Reserve official unleashed a wave of bets on aggressi… [+2867 chars]",0,1,0,0,0,1,1,1
17,How a Russian-Ukraine conflict might hit global markets - Reuters,2022-01-25T15:56:00Z,https://www.reuters.com/markets/europe/how-russian-ukraine-conflict-might-hit-global-markets-2022-01-25/,"LONDON, Jan 25 (Reuters) - A potential invasion of Ukraine by neighbouring Russia would be felt across a number of markets, from wheat and energy prices and the region's sovereign dollar bonds to saf… [+7174 chars]",0.247,0.753,0,-0.3182,-1,-1,1,1
18,How a Russia-Ukraine conflict might hit global markets - Reuters,2022-02-19T12:20:00Z,https://www.reuters.com/markets/europe/how-russia-ukraine-conflict-might-hit-global-markets-2022-02-19/,"LONDON, Feb 19 (Reuters) - A potential invasion of Ukraine by neighbouring Russia would be felt across a number of markets, from wheat and energy prices and the region's sovereign dollar bonds to saf… [+6946 chars]",0.247,0.753,0,-0.3182,-1,-1,1,1
19,"Meta Platforms' (FB) Q4 Earnings Miss Mark, Revenues Up Y/Y",2022-02-03T16:46:00Z,http://www.zacks.com/stock/news/1862154/meta-platforms-fb-q4-earnings-miss-mark-revenues-up-y-y?cid=CS-ENTREPRENEUR-FT-analyst_blog|earnings_article-1862154,Meta PlatformsFB fourth-quarter 2021 earnings of $3.67 per share missed the Zacks Consensus Estimate by 2.91% and decreased 5.4% year over year.Revenues of $33.67 billion beat the Zacks Consensus Est… [+7372 chars],0.151,0.849,0,-0.1531,-1,1,1,1
20,Revolut's overseas expansion overlaps with big incumbents' retrenchment and refocus on their core,2022-02-16T15:30:00Z,https://www.businessinsider.com/neobank-revolut-makes-moves-to-expand-into-australia-and-india-2022-2,"The news: UK-based 
neobank Revolut made two moves to expand its presence in Australia and India.
Insider Intelligence
The company obtained an Australian Credit Licence, which was green-lit by the… [+3381 chars]",0,1,0,0,0,0,1,1
21,Forex held by Turks drops $3.07 billion last week - Reuters,2022-02-10T11:55:00Z,https://www.reuters.com/markets/rates-bonds/forex-held-by-turks-drops-307-billion-last-week-2022-02-10/,"ISTANBUL, Feb 10 (Reuters) - Turkish locals' foreign currency and gold holdings dropped by $3.07 billion to $225.09 billion as of Feb. 4, data showed on Thursday.
The forex and gold holdings hit a r… [+469 chars]",0,1,0,0,0,-1,1,1
22,LIVE MARKETS Forex: worrying about an inverted yield curve - Reuters,2022-02-18T12:33:00Z,https://www.reuters.com/markets/stocks/live-markets-forex-worrying-about-an-inverted-yield-curve-2022-02-18/,"Feb 18 - Welcome to the home for real-time coverage of markets brought to you by Reuters reporters. You can share your thoughts with us at markets.research@thomsonreuters.com
FOREX: WORRYING ABOUT A… [+6636 chars]",0.211,0.789,0,-0.34,-1,-1,1,0
23,Taiwan lifts forex trading punishment on Deutsche -sources - Reuters,2022-02-07T08:38:00Z,https://www.reuters.com/business/finance/taiwan-lifts-forex-trading-punishment-deutsche-sources-2022-02-07/,"TAIPEI, Feb 7 (Reuters) - Taiwan's central bank has allowed Deutsche Bank (DBKGn.DE) to start trading Taiwan dollar deliverable and non-deliverable forwards again, three sources told Reuters, after i… [+2099 chars]",0.286,0.714,0,-0.4939,-1,1,1,0
24,China's Jan forex reserves fall to $3.22 trln - Reuters,2022-02-07T09:00:00Z,https://www.reuters.com/markets/currencies/chinas-jan-forex-reserves-fall-322-trln-2022-02-07/,"BEIJING, Feb 7 - China's foreign exchange reserves unexpectedly fell in January as the dollar gained, official data showed on Monday.
The country's foreign exchange reserves - the world's largest - … [+688 chars]",0,1,0,0,0,-1,1,0
25,"Turkish lira dips, minister sees more forex converted to lira - Reuters",2022-01-24T05:56:00Z,https://www.reuters.com/markets/rates-bonds/turkish-lira-dips-minister-sees-more-forex-converted-lira-2022-01-24/,"ISTANBUL, Jan 24 (Reuters) - The lira was slightly weaker on Monday after Turkey's finance minister was cited as saying he expected some $10 billion of forex bank deposits to be converted to lira due… [+2720 chars]",0,1,0,0,0,-1,1,0
26,Turkish cenbank says it will develop tools to support lira - Reuters,2022-01-27T11:16:00Z,https://www.reuters.com/world/middle-east/turkish-cenbank-says-it-will-develop-tools-support-lira-2022-01-27/,"A money changer counts Turkish lira banknotes at a currency exchange office in Ankara, Turkey September 27, 2021. REUTERS/Cagla Gurdogan//File PhotoISTANBUL, Jan 27 (Reuters) - Turkey's central bank … [+604 chars]",0,0.787,0.213,0.4019,1,0,1,0
27,Turkey forex sales to state firms hit record $4.15 bln in Jan - Reuters,2022-02-07T08:47:00Z,https://www.reuters.com/markets/rates-bonds/turkey-forex-sales-state-firms-hit-record-415-bln-jan-2022-02-07/,"ISTANBUL, Feb 7 (Reuters) - Sales of foreign currency to Turkey's state economic enterprises - primarily energy importer BOTAS - reached a record $4.15 billion in January, the central bank said on Mo… [+2468 chars]",0,1,0,0,0,1,1,0
28,China-U.S. monetary policy divergence aids yuan stability - ex-regulator - Reuters,2022-02-16T02:49:00Z,https://www.reuters.com/markets/currencies/china-us-monetary-policy-divergence-aids-yuan-stability-ex-regulator-2022-02-16/,"SHANGHAI, Feb 16 (Reuters) - Increasingly divergent monetary policies between China and the United States would help rein in an excessive rise in the yuan by reducing foreign money inflows, a former … [+1746 chars]",0,1,0,0,0,1,1,0
29,Here's Why You Should Retain West Pharmaceutical (WST) Now,2022-02-01T16:50:00Z,http://www.zacks.com/stock/news/1860680/here-s-why-you-should-retain-west-pharmaceutical-wst-now?cid=CS-ENTREPRENEUR-FT-analyst_blog|rank_focused-1860680,"West Pharmaceutical Services, Inc.WST is well-poised for growth backed by a robust Proprietary Products segment and sustained strength in research and development (R&amp;D). However, forex remains a … [+5201 chars]",0,1,0,0,0,0,1,0
30,China forex regulator aims to defuse risk of external shocks - Reuters,2022-01-21T04:40:00Z,https://www.reuters.com/markets/currencies/china-forex-regulator-aims-defuse-risk-external-shocks-2022-01-21/,"SHANGHAI, Jan 21 (Reuters) - China must prevent and defuse the risk of external shocks this year while strengthening macro-prudential management and guiding market expectations, the country's foreign… [+1815 chars]",0.343,0.657,0,-0.5719,-1,1,1,0
31,Zimbabwe eases forex tax rules to shore up local currency - Reuters,2022-02-04T13:23:00Z,https://www.reuters.com/world/africa/zimbabwe-eases-forex-tax-rules-shore-up-local-currency-2022-02-04/,"HARARE, Feb 4 (Reuters) - Zimbabwe has reduced the portion of taxes payable in foreign currency, Finance Minister Mthuli Ncube said on Friday, as the country tries to reduce U.S dollar demand and sto… [+2034 chars]",0,0.813,0.187,0.3182,1,1,1,0
32,"FOREX-Dollar restrained by risk revival, spread of rate speculation - Reuters.com",2022-02-01T23:13:00Z,https://www.reuters.com/article/global-forex-idUSKBN2K64HN,SYDNEY (Reuters) - The dollar was carrying a couple of bruises on Wednesday as Federal Reserve officials played down the chance of a half point rate hike in March and a rally in global equity markets… [+2523 chars],0.189,0.811,0,-0.2732,-1,-1,1,1
33,Russia counts on reserves as shield against sanctions - FinMin - Reuters,2022-02-16T12:00:00Z,https://www.reuters.com/markets/europe/russia-counts-reserves-shield-against-sanctions-finmin-2022-02-16/,"MOSCOW, Feb 16 (Reuters) - Possible western sanctions against Russian banks will lead to a spike in market volatility but Russia will be able to withstand restrictions thanks to abundant reserves, Fi… [+1455 chars]",0,1,0,0,0,0,1,0
34,Key remarks from Russian c.bank governor after rate decision - Reuters,2022-02-11T12:26:00Z,https://www.reuters.com/markets/currencies/key-remarks-russian-cbank-governor-after-rate-decision-2022-02-11/,"MOSCOW, Feb 11 (Reuters) - The Russian Central Bank Governor Elvira Nabiullina spoke at an online press conference after the central bank raised its key rate to 9.5% on Friday. read more 
Nabiullina… [+1447 chars]",0,1,0,0,0,0,1,0
35,Erdogan urges Turks to convert foreign currency savings to lira - Reuters,2022-01-19T17:32:00Z,https://www.reuters.com/world/middle-east/erdogan-urges-turks-convert-foreign-currency-savings-lira-2022-01-19/,"A money changer counts Turkish lira bills at an currency exchange office in Istanbul December 16, 2014. REUTERS/Murad SezerISTANBUL, Jan 19 (Reuters) - President Tayyip Erdogan called on Turkish citi… [+555 chars]",0,1,0,0,0,0,1,0
36,ServiceNow (NOW) Q4 Earnings & Revenues Surpass Estimates,2022-01-27T16:50:00Z,http://www.zacks.com/stock/news/1858400/servicenow-now-q4-earnings-revenues-surpass-estimates?cid=CS-ENTREPRENEUR-FT-analyst_blog|earnings_article-1858400,"ServiceNowNOW reported fourth-quarter 2021 adjusted earnings of $1.46 per share, which beat the Zacks Consensus Estimate by 2.1% and improved 24.8% year over year.Revenues of $1.61 billion surpassed … [+4627 chars]",0,1,0,0,0,1,1,0
37,Turkey pitches its unorthodox policy to London investors - Reuters,2022-02-08T07:59:00Z,https://www.reuters.com/markets/rates-bonds/turkey-pitches-its-unorthodox-policy-london-investors-2022-02-08/,"ANKARA, Feb 8 (Reuters) - The lira weakened on Tuesday as Finance Minister Nureddin Nebati pitched Turkey's unorthodox economic policy to investors in London, while data indicated the central bank's … [+2647 chars]",0,1,0,0,0,0,1,0
38,Turkish cenbank's net FX reserves surge to $16.33 bln - Reuters,2022-02-10T12:15:00Z,https://www.reuters.com/markets/rates-bonds/turkish-cenbanks-net-fx-reserves-surge-1633-bln-2022-02-10/,"ISTANBUL, Feb 10 (Reuters) - The Turkish central bank's net international reserves leapt $5.8 billion last week to $16.33 billion as of Feb. 4, data showed on Thursday, having tumbled to a 20-year lo… [+2166 chars]",0,1,0,0,0,1,1,0
39,China could take further measures to rein in yuan- former regulator - Reuters,2022-02-07T01:44:00Z,https://www.reuters.com/world/china/china-could-take-further-measures-rein-yuan-former-regulator-2022-02-07/,"SHANGHAI, Feb 7 (Reuters) - The Chinese government could take further measures if needed to keep the yuan stable, potentially putting downward pressure on the currency, a former foreign exchange regu… [+1426 chars]",0,1,0,0,0,0,1,0
40,"Bank of Israel bought $356 million of FX in January, QE ends - Reuters",2022-02-07T12:58:00Z,https://www.reuters.com/markets/currencies/bank-israel-bought-356-million-fx-january-qe-ends-2022-02-07/,"JERUSALEM, Feb 7 (Reuters) - The Bank of Israel said on Monday it bought $356 million of foreign currency in January as it tries to contain a strong shekel .
Despite the purchases, Israel's foreign … [+1504 chars]",0,1,0,0,0,0,1,0
41,"Ukraine crisis has financial markets spooked, but not yet despondent | Larry Elliott",2022-02-14T19:10:09Z,https://amp.theguardian.com/business/nils-pratley-on-finance/2022/feb/14/ukraine-crisis-has-financial-markets-spooked-but-not-yet-despondent,"The threat of a Russian invasion of Ukraine has left financial markets jittery but not yet panicky. Unsurprisingly, shares took a tumble on the worlds bourses and there was a brief rise in oil prices… [+3844 chars]",0.161,0.63,0.21,0.1977,1,-1,1,0
43,How to punish Russia for Ukraine,2022-02-08T12:00:00Z,https://www.vox.com/22916773/russia-ukraine-sanctions-putin,"Russian President Vladimir Putin, after meeting with French President Emmanuel Macron in Moscow on February 7. International efforts to defuse the standoff over Ukraine intensified with Macron in Mos… [+14478 chars]",0.405,0.595,0,-0.5267,-1,-1,1,0
44,Markets Stressed By Fed And Russia - Can Stocks Bounce Back?,2022-01-29T18:58:46Z,https://www.forbes.com/sites/mikeosullivan/2022/01/29/markets-stressed-by-fed-and-russiacan-stocks-bounce-back/,"ST. PETERSBURG, RUSSIA. JANUARY 21, 2016. A digital board displaying currency exchange rates outside ... [+] an exchange office. Euro rises above 91 and US Dollar above 84 against Russian Ruble in th… [+6453 chars]",0.211,0.789,0,-0.34,-1,-1,1,0
47,Will fears of ‘Russian invasion’ of Ukraine obliterate world financial markets?,2022-01-26T11:58:33Z,https://www.rt.com/business/547283-russian-invasion-ukraine-market-fear/,"NATO announced this week it was putting forces on standby and reinforcing Eastern Europe with more ships and fighter jets, as the US continues to accuse Russia of gearing up to invade Ukraine. Moscow… [+4515 chars]",0.427,0.573,0,-0.7717,-1,-1,1,0
48,"Explained: How Russia-Ukraine crisis impacts oil prices, equity markets",2022-02-22T06:56:47Z,https://indianexpress.com/article/explained/russia-ukraine-crisis-oil-prices-equity-markets-7785144/,"Brent crude prices hit $96.7 per barrel on Tuesday, the highest mark since September 2014, following Russian President Vladimir Putins deployment of troops to separatist areas Donetsk and Luhansk in … [+4777 chars]",0.339,0.661,0,-0.6249,-1,-1,1,0
49,Rising costs of Ukraine gamble could force Russia’s hand,2022-01-24T18:27:12Z,https://amp.theguardian.com/world/2022/jan/24/rising-costs-of-ukraine-gamble-could-force-russias-hand,"Russias aggressive buildup near Ukraine energised Nato into sending more forces to eastern Europe on Monday and led to a plunge on Russian markets, raising the stakes on the Kremlins bet that it coul… [+4380 chars]",0,0.714,0.286,0.4939,1,0,1,0
50,European stocks join Asia sell-off as Russia-Ukraine tensions grow - Yahoo Tech,2022-01-24T08:57:28Z,https://finance.yahoo.com/news/european-stocks-russia-ukraine-tensions-ftse-cac-dax-085728395.html,"Volunteer defence units train in Kyiv as worries about a possible military conflict between Ukraine and Russia rattle stock markets. Photo: Sean Gallup/Getty
European stock markets have started the … [+3326 chars]",0.194,0.647,0.158,-0.128,-1,-1,1,1
51,US sanctions over Russian attack on Ukraine could roil financial markets - The Washington Post,2022-02-13T22:18:45Z,https://www.washingtonpost.com/us-policy/2022/02/13/russia-ukraine-sanctions-markets/,"A telephone conversation on Saturday between President Biden and Russian President Vladimir Putin did nothing to ease the tension over the massive Russian military buildup surrounding Ukraine, a seni… [+9757 chars]",0.193,0.807,0,-0.4767,-1,-1,1,0
53,Shifting Monetary Policy And The Equity Investing Dilemma,2022-01-29T08:45:00Z,https://seekingalpha.com/article/4482714-shifting-monetary-policy-and-the-equity-investing-dilemma, Changes to monetary policy loom large over financial markets as 2022 begins. While policy and interest rates always affec… [+6437 chars],0.195,0.805,0,-0.1779,-1,-1,1,0
54,FTSE rises on more dovish sounds out of US Fed,2022-02-01T17:18:24Z,https://www.independent.co.uk/business/ftse-rises-on-more-dovish-sounds-out-of-us-fed-b2005305.html,"After a cold start to the week, the FTSE 100 came back with another strong performance on Tuesday, shaking off the fears from a week ago over the military situation in eastern Europe.
Markets across… [+3574 chars]",0,1,0,0,0,1,1,0
55,Asian markets swing as crucial US inflation data looms,2022-02-10T03:05:38Z,https://news.yahoo.com/asian-markets-swing-crucial-us-030538660.html,"Asian investors moved tentatively on Thursday as they jostle ahead of the release of US inflation data later in the day that could have a huge bearing on the Federal Reserve's rate hike plans.
A bro… [+4313 chars]",0.167,0.833,0,-0.1531,-1,-1,1,0
56,"Asian shares, US futures slide as traders fret about Ukraine, rate rises",2022-01-25T02:42:43Z,https://www.moneycontrol.com/news/business/markets/asian-shares-us-futures-slide-as-traders-fret-about-ukraine-rate-rises-7979031.html,"Asian shares and U.S. futures tumbled on Tuesday after a tumultuous Wall Street session, with investors nervous about the situation in Ukraine and eyeing the U.S. Federal Reserve amid worries about a… [+2916 chars]",0,0.833,0.167,0.296,1,-1,1,0
57,"Stocks Are on a Wild Ride. 20 Bargains to Buy Now, According to Barron’s Roundtable Experts.",2022-01-29T00:14:00Z,https://www.barrons.com/articles/roundtable-2022-investing-stock-picks-51643414945,"Fed be nimble, Fed be quick. The quicker, the better, in fact. Hike interest rates, shrink your balance sheet, and lets be done with it all before the stock market sinks even further.The markets rece… [+41883 chars]",0,1,0,0,0,-1,1,0
58,Asian markets track losses on Wall St on Ukraine conflict fears,2022-02-14T02:39:31Z,https://news.yahoo.com/asian-markets-track-losses-wall-023931988.html,"Asian markets fell and oil prices rallied Monday after the United States warned Russia could attack Ukraine within days as diplomatic efforts to prevent a war appeared to fail, while fears over infla… [+2665 chars]",0.494,0.506,0,-0.7783,-1,-1,1,0
59,"If The Market Panicked, Will The Fed?",2022-02-11T12:45:00Z,https://seekingalpha.com/article/4486285-if-market-panicked-will-fed," The higher-than-expected US CPI, coupled with strong comments from the Federal Reserve's leading hawk, saw a surge in interest rates, knocking s… [+9097 chars]",0.333,0.667,0,-0.4588,-1,-1,1,1
60,Chaos on international markets as worries build over Russia tensions,2022-01-24T17:29:19Z,https://www.independent.co.uk/business/chaos-on-international-markets-as-worries-build-over-russia-tensions-b1999647.html,"A bruising day on global markets pushed the FTSE 100 to its lowest point in a month though the index avoided some of the malaise of its European peers.
The index closed down 2.6% after initially loo… [+3342 chars]",0.568,0.432,0,-0.8481,-1,-1,1,1
61,How a Russian-Ukraine conflict might hit global markets,2022-01-25T16:07:00Z,https://www.channelnewsasia.com/business/how-russian-ukraine-conflict-might-hit-global-markets-2459221,"LONDON: A potential invasion of Ukraine by neighbouring Russia would be felt across a number of markets, from wheat and energy prices and the region's sovereign dollar bonds to safe-haven assets and … [+6325 chars]",0.277,0.723,0,-0.3182,-1,-1,1,0
62,How a Russia-Ukraine conflict might hit global markets,2022-02-19T12:35:04Z,https://www.channelnewsasia.com/business/how-russia-ukraine-conflict-might-hit-global-markets-2508751,"LONDON : A potential invasion of Ukraine by neighbouring Russia would be felt across a number of markets, from wheat and energy prices and the region's sovereign dollar bonds to safe-haven assets and… [+7634 chars]",0.277,0.723,0,-0.3182,-1,-1,1,0
63,"January 2022 in Precious Metals, by Steven Cochran",2022-01-31T21:50:08Z,https://survivalblog.com/2022/02/01/january-2022-precious-metals-steven-cochran/,"Welcome to SurvivalBlog’s Precious Metals Month in Review, where we take a look at the month that was in precious metals. Each month, we cover gold’s performance and the factors that affected gold pr… [+12106 chars]",0,0.654,0.346,0.5719,1,0,1,0
