Column1,title,publishedAt,url,content,vader_neg,vader_neu,vader_pos,vader_comp,vader_label,label,include,relevant
1667,3 Infrastructure Stocks to Add to Your Portfolio in February,2022-01-31T14:29:51Z,https://stocknews.com/news/unp-crh-bipc-3-infrastructure-stocks-to-add-to-your-portfolio-in-february/,"Despite current market disruption that is driven by a resurgence of COVID-19, rising inflation, impending interest rate increases, and supply chain challenges, the near-term outlook for the infrastructure industry looks...",0,1,0,0,0,1,1,0
1668,Lagarde comments at ECB press conference - Reuters.com,2022-02-03T16:23:00Z,https://www.reuters.com/article/ecb-policy-lagarde-idUSKBN2K81I9,"The European Central Bank kept policy unchanged as expected on Thursday, staying on track to provide copious stimulus this year even as inflation runs at a record high, exceeding both the bank's 2% target and its projections.",0,1,0,0,0,0,1,0
1669,How a Russian-Ukraine conflict might hit global markets - The Globe and Mail,2022-01-25T16:11:30Z,https://www.theglobeandmail.com/investing/investment-ideas/article-how-a-russian-ukraine-conflict-might-hit-global-markets-2/,"<ol><li>How a Russian-Ukraine conflict might hit global markets  The Globe and Mail
</li><li>Markets see wild swings as investors fret over Ukraine, US interest rate hikes • FRANCE 24 English  FRANCE 24 English
</li><li>Stocks climb back after steep slide o…",0.187,0.813,0,-0.3182,-1,-1,1,0
1670,"Gold price tumbles $35 as Fed's Powell says inflation 'is slightly worse' than in December, signals March rate hike - Kitco NEWS",2022-01-26T20:45:00Z,https://www.kitco.com/news/2022-01-26/Gold-price-tumbles-35-as-Fed-s-Powell-says-inflation-is-slightly-worse-than-in-December-signals-March-rate-hike.html,"<ol><li>Gold price tumbles $35 as Fed's Powell says inflation 'is slightly worse' than in December, signals March rate hike  Kitco NEWS
</li><li>David Rosenberg: The Fed will hike rates this year - but this is what's going to be the bigger surprise  The Glob…",0.123,0.877,0,-0.4228,-1,-1,1,0
1671,"LIVE MARKETS Fed tightening, a roadmap for equities - Reuters",2022-02-14T11:28:00Z,https://www.reuters.com/markets/stocks/live-markets-fed-tightening-roadmap-equities-2022-02-14/,"Welcome to the home for real-time coverage of markets brought to you by Reuters reporters. You can share your thoughts with us at <a href=""mailto:markets.research@thomsonreuters.com"" target=""_blank"">markets.research@thomsonreuters.com</a>",0,1,0,0,0,0,1,0
1672,LIVE MARKETS 98% of STOXX in the red - Reuters,2022-02-14T09:15:00Z,https://www.reuters.com/markets/stocks/live-markets-98-stoxx-red-2022-02-14/,"Welcome to the home for real-time coverage of markets brought to you by Reuters reporters. You can share your thoughts with us at <a href=""mailto:markets.research@thomsonreuters.com"" target=""_blank"">markets.research@thomsonreuters.com</a>",0,1,0,0,0,0,1,0
1673,LIVE MARKETS Fed sends Europe's tech to check out the bears - Reuters,2022-01-27T09:20:00Z,https://www.reuters.com/markets/stocks/live-markets-fed-sends-europes-tech-check-out-bears-2022-01-27/,"Welcome to the home for real-time coverage of markets brought to you by Reuters reporters. You can share your thoughts with us at <a href=""mailto:markets.research@thomsonreuters.com"" target=""_blank"">markets.research@thomsonreuters.com</a>",0,1,0,0,0,0,1,1
1674,LIVE MARKETS Irish banks' rally has legs - Reuters,2022-02-14T12:48:00Z,https://www.reuters.com/markets/stocks/live-markets-irish-banks-rally-has-legs-2022-02-14/,"Welcome to the home for real-time coverage of markets brought to you by Reuters reporters. You can share your thoughts with us at <a href=""mailto:markets.research@thomsonreuters.com"" target=""_blank"">markets.research@thomsonreuters.com</a>",0,1,0,0,0,0,1,0
1675,LIVE MARKETS Pricing fifty shades of grey - Reuters,2022-02-21T07:39:00Z,https://www.reuters.com/markets/stocks/live-markets-pricing-fifty-shades-grey-2022-02-21/,"Welcome to the home for real-time coverage of markets brought to you by Reuters reporters. You can share your thoughts with us at <a href=""mailto:markets.research@thomsonreuters.com"" target=""_blank"">markets.research@thomsonreuters.com</a>",0,0.854,0.146,0.0516,1,0,1,0
1676,LIVE MARKETS A different equity market - Reuters,2022-02-23T09:07:00Z,https://www.reuters.com/markets/stocks/live-markets-different-equity-market-2022-02-23/,"Feb 23 - Welcome to the home for real-time coverage of markets brought to you by Reuters reporters. You can share your thoughts with us at markets.research@thomsonreuters.com
A DIFFERENT EQUITY MARK… [+5532 chars]",0,1,0,0,0,0,1,0
1677,LIVE MARKETS Chip stocks tumble in latest volatile session - Reuters,2022-02-17T17:23:00Z,https://www.reuters.com/markets/asia/live-markets-chip-stocks-tumble-latest-volatile-session-2022-02-17/,"Feb 17 - Welcome to the home for real-time coverage of markets brought to you by Reuters reporters. You can share your thoughts with us at markets.research@thomsonreuters.com
CHIP STOCKS TUMBLE IN L… [+9804 chars]",0,1,0,0,0,-1,1,0
1678,Stock market news live updates: Tech stocks lift indexes as earnings roll in - Yahoo Canada Finance,2022-02-09T21:05:09Z,https://ca.finance.yahoo.com/news/stock-market-news-live-updates-february-9-2022-231253066.html,"Stocks advanced Wednesday as investors considered another batch of solid quarterly corporate earnings results and looked ahead to more reports.
The S&amp;P 500 extended gains from the regular tradin… [+7822 chars]",0,1,0,0,0,1,1,0
1679,LIVE MARKETS More individual investors see a flat market - Reuters,2022-02-11T15:26:00Z,https://www.reuters.com/markets/asia/live-markets-more-individual-investors-see-flat-market-2022-02-11/,"Feb 11 - Welcome to the home for real-time coverage of markets brought to you by Reuters reporters. You can share your thoughts with us at markets.research@thomsonreuters.com
MORE INDIVIDUAL INVESTO… [+4602 chars]",0,1,0,0,0,0,1,0
1680,LIVE MARKETS Stock splits usually bullish for companies-BofA - Reuters,2022-02-08T19:15:00Z,https://www.reuters.com/markets/asia/live-markets-stock-splits-usually-bullish-companies-bofa-2022-02-08/,"Feb 8 - Welcome to the home for real-time coverage of markets brought to you by Reuters reporters. You can share your thoughts with us at markets.research@thomsonreuters.com
STOCK SPLITS USUALLY BUL… [+13047 chars]",0,1,0,0,0,0,1,0
1681,LIVE MARKETS What history says about geopolitics and the market - Reuters,2022-02-18T16:00:00Z,https://www.reuters.com/markets/asia/live-markets-what-history-says-about-geopolitics-market-2022-02-18/,"Feb 18 - Welcome to the home for real-time coverage of markets brought to you by Reuters reporters. You can share your thoughts with us at markets.research@thomsonreuters.com
WHAT HISTORY SAYS ABOUT… [+6535 chars]",0,1,0,0,0,0,1,0
1682,A Russian stock ETF plunges 23% as the country's market remains closed amid deep losses,2022-02-28T14:58:22Z,https://markets.businessinsider.com/news/etf/vaneck-russia-etf-rsx-ukraine-war-us-sanctions-market-closed-2022-2,"The VanEck Russia ETF plummeted 23% Monday as more sanctions against Moscow pile up while Russian troops ramp up their assault on Ukraine. 
The Russian central bank closed the country's stock market… [+1236 chars]",0.172,0.828,0,-0.4019,-1,-1,1,0
1683,Stock market news live updates: Stocks recover some losses after S&P 500 tumbles into correction - Yahoo Canada Finance,2022-02-23T14:33:16Z,https://ca.finance.yahoo.com/news/stock-market-news-live-updates-february-23-2022-231403641.html,"Stocks erased earlier gains to trader lower on Wednesday. This extended losses for the major indexes after a steep sell-off during Tuesday's trading day, which pushed the S&amp;P 500 and Dow to their… [+6587 chars]",0.137,0.863,0,-0.4019,-1,1,1,0
1684,"All in a day: Zuckerberg loses US$29-billion, Bezos set to pocket US$20-billion - The Globe and Mail",2022-02-03T19:33:17Z,https://www.theglobeandmail.com/investing/investment-ideas/article-zuckerberg-loses-us29-billion-in-a-day-as-meta-shares-crash/,"Facebook Chief Executive Officer Mark Zuckerberg, left, testifies before the House Financial Services Committee on Capitol Hill in Washington, about his plans for the new cryptocurrency Libra, Wednes… [+2624 chars]",0.141,0.859,0,-0.3182,-1,-1,1,0
1685,"LIVE MARKETS Bears, bears everywhere - Reuters",2022-02-25T14:03:00Z,https://www.reuters.com/markets/asia/live-markets-bears-bears-everywhere-2022-02-25/,"Feb 25 - Welcome to the home for real-time coverage of markets brought to you by Reuters reporters. You can share your thoughts with us at markets.research@thomsonreuters.com
BEARS, BEARS EVERYWHERE… [+2255 chars]",0,1,0,0,0,-1,1,0
1686,LIVE MARKETS The Street's playbook for navigating market chaos - Reuters,2022-02-25T12:01:00Z,https://www.reuters.com/markets/stocks/live-markets-streets-playbook-navigating-market-chaos-2022-02-25/,"Feb 25 - Welcome to the home for real-time coverage of markets brought to you by Reuters reporters. You can share your thoughts with us at markets.research@thomsonreuters.com
THE STREET'S PLAYBOOK F… [+9288 chars]",0.291,0.709,0,-0.5719,-1,0,1,0
1687,"Stock market news live updates: Stocks rise as investors eye strong data, Russia's attacks in Ukraine - Yahoo Canada Finance",2022-02-25T14:34:06Z,https://ca.finance.yahoo.com/news/stock-market-news-live-updates-february-25-2022-231258803.html,"Stocks were mixed on Friday as traders eyed the latest developments in Russia's invasion of Ukraine and the world's response.
The S&amp;P 500 rose, rising further after a 1.5% jump on Thursday. The … [+9380 chars]",0.125,0.733,0.142,0.1027,1,1,1,0
1688,John Lewis logistics firm Clipper agrees £940m US takeover,2022-02-21T08:56:28Z,https://amp.theguardian.com/business/2022/feb/21/john-lewis-logistics-clipper-takeover-gxo,"A warehousing company that counts John Lewis, Marks &amp; Spencer, Morrisons and Asda among its customers has agreed a possible takeover deal worth up to £940m with a New York rival, in the latest si… [+2509 chars]",0,0.816,0.184,0.2023,1,0,1,0
1689,"LIVE MARKETS Stocks gain broadly, building on Thursday's late rally - Reuters",2022-02-25T15:05:00Z,https://www.reuters.com/markets/asia/live-markets-stocks-gain-broadly-building-thursdays-late-rally-2022-02-25/,"Feb 25 - Welcome to the home for real-time coverage of markets brought to you by Reuters reporters. You can share your thoughts with us at markets.research@thomsonreuters.com
STOCKS GAIN BROADLY, BU… [+3411 chars]",0,0.746,0.254,0.5267,1,1,1,0
1690,"Zacks Market Edge Highlights: Alphabet, Intuitive Surgical, The Estee Lauder Companies and Costco",2022-02-17T08:46:00Z,http://www.zacks.com/stock/news/1868846/zacks-market-edge-highlights-alphabet-intuitive-surgical-the-estee-lauder-companies-and-costco?cid=CS-ENTREPRENEUR-FT-press_releases-1868846,"For Immediate Release
Chicago, IL February 17, 2022 Zacks Market Edge is a podcast hosted weekly by Zacks Stock Strategist Tracey Ryniec. Every week, Tracey will be joined by guests to discuss the h… [+7154 chars]",0,1,0,0,0,0,1,0
1691,US Ecology (ECOL) Q4 Earnings Lag Estimates,2022-02-25T12:25:06Z,http://www.zacks.com/stock/news/1873204/us-ecology-ecol-q4-earnings-lag-estimates?cid=CS-ENTREPRENEUR-FT-tale_of_the_tape|yseop_template_4-1873204,"US Ecology (ECOL) came out with quarterly earnings of $0.13 per share, missing the Zacks Consensus Estimate of $0.25 per share. This compares to earnings of $0.19 per share a year ago. These figures … [+4394 chars]",0.286,0.714,0,-0.34,-1,-1,1,0
1692,LIVE MARKETS What's in $300 billion? - Reuters,2022-02-25T15:54:00Z,https://www.reuters.com/markets/asia/live-markets-whats-300-billion-2022-02-25/,"Feb 25 - Welcome to the home for real-time coverage of markets brought to you by Reuters reporters. You can share your thoughts with us at markets.research@thomsonreuters.com
WHAT'S IN $300 BILLION?… [+6043 chars]",0,1,0,0,0,0,1,0
1693,Stock market news live updates: Stocks open flat as Russia intensifies attacks on Ukraine - Yahoo Canada Finance,2022-03-01T14:36:21Z,https://ca.finance.yahoo.com/news/stock-market-news-live-updates-march-1-2022-234725203.html,U.S. stocks fell on Tuesday following another volatile day on Wall Street as investors weighed intensifying Russian attacks on Ukraine and an onslaught of new sanctions by the West against the likeli… [+9313 chars],0.153,0.847,0,-0.4404,-1,-1,1,0
1694,LIVE MARKETS EasyJet: a timely FTSE 100 booster? - Reuters,2022-02-23T11:44:00Z,https://www.reuters.com/markets/stocks/live-markets-easyjet-timely-ftse-100-booster-2022-02-23/,"Feb 23 - Welcome to the home for real-time coverage of markets brought to you by Reuters reporters. You can share your thoughts with us at markets.research@thomsonreuters.com
EASYJET: A TIMELY FTSE … [+6964 chars]",0,1,0,0,0,0,1,0
1695,"LIVE MARKETS Global macro, credit-focused hedge funds shine during bumpy January - Reuters",2022-02-18T17:34:00Z,https://www.reuters.com/markets/asia/live-markets-global-macro-credit-focused-hedge-funds-shine-during-bumpy-january-2022-02-18/,"Feb 18 - Welcome to the home for real-time coverage of markets brought to you by Reuters reporters. You can share your thoughts with us at markets.research@thomsonreuters.com
GLOBAL MACRO, CREDIT-FO… [+10251 chars]",0,1,0,0,0,1,1,0
1696,US Consumer Sentiment Slips in February: Will ETFs Suffer?,2022-02-15T21:00:00Z,http://www.zacks.com/stock/news/1868061/us-consumer-sentiment-slips-in-february-will-etfs-suffer?cid=CS-ENTREPRENEUR-FT-etf_news_and_commentary-1868061,U.S. consumers are feeling the heat of the continuously rising inflation levels. The latest disappointing preliminary consumer sentiment readings for early February that have slipped to the lowest le… [+6765 chars],0.304,0.696,0,-0.5423,-1,-1,1,0
1697,Stocks set for a painful week as conflict intensifies; bonds to gain - The Globe and Mail,2022-02-27T18:48:23Z,https://www.theglobeandmail.com/business/international-business/article-stocks-set-for-a-painful-week-as-conflict-intensifies-bonds-to-gain/,World markets were set for another tumultuous week after Western countries announced a harsh set of sanctions to punish Russia for its invasion of Ukraine and as fighting intensified for a fourth day… [+3346 chars],0.252,0.583,0.165,-0.2023,-1,-1,1,0
1698,"LIVE MARKETS After credit spread widening, Wells Fargo sees buying opportunity - Reuters",2022-02-25T16:33:00Z,https://www.reuters.com/markets/asia/live-markets-after-credit-spread-widening-wells-fargo-sees-buying-opportunity-2022-02-25/,"Feb 25 - Welcome to the home for real-time coverage of markets brought to you by Reuters reporters. You can share your thoughts with us at markets.research@thomsonreuters.com
AFTER CREDIT SPREAD WID… [+8104 chars]",0,0.549,0.451,0.7506,1,1,1,0
1699,Stock market news live updates: Stock futures jump after Russia reports pullback of military troops - Yahoo Canada Finance,2022-02-15T13:36:03Z,https://ca.finance.yahoo.com/news/stock-market-news-live-updates-february-15-2022-235016255.html,Wall Streets main benchmarks rose Tuesday morning despite another red-hot inflation print as investors weighed news some Russian military units will start returning to their permanent bases after com… [+7883 chars],0,1,0,0,0,1,1,0
1700,10 things before the opening bell,2022-02-25T11:32:33Z,https://markets.businessinsider.com/news/stocks/10-things-before-the-opening-bell-february-25-2022-2,"Good morning, readers. War is escalating in Ukraine and global markets have tumbled. Today we're breaking down what this means for investors.
If this was forwarded to you, sign up here. Download Ins… [+4103 chars]",0,1,0,0,0,0,1,0
1701,"LIVE MARKETS Red, red wine: inflation proof? - Reuters",2022-02-18T19:07:00Z,https://www.reuters.com/markets/asia/live-markets-red-red-wine-inflation-proof-2022-02-18/,"Feb 19 - Welcome to the home for real-time coverage of markets brought to you by Reuters reporters. You can share your thoughts with us at markets.research@thomsonreuters.com
RED, RED WINE: INFLATIO… [+15620 chars]",0,1,0,0,0,0,1,0
1702,"LIVE MARKETS Up, up they go - Reuters",2022-02-09T07:56:00Z,https://www.reuters.com/markets/stocks/live-markets-up-up-they-go-2022-02-09/,"Feb 9 - Welcome to the home for real-time coverage of markets brought to you by Reuters reporters. You can share your thoughts with us at markets.research@thomsonreuters.com
UP, UP THEY GO (0755 GMT… [+3578 chars]",0,1,0,0,0,1,1,0
1703,Is Vanguard Total Stock Market Index Investor (VTSMX) a Strong Mutual Fund Pick Right Now?,2022-02-21T12:00:08Z,http://www.zacks.com/stock/news/1870381/is-vanguard-total-stock-market-index-investor-vtsmx-a-strong-mutual-fund-pick-right-now?cid=CS-ENTREPRENEUR-FT-mutual_fund_equity_report-1870381,"Looking for a Mutual Fund Equity Report fund? You may want to consider Vanguard Total Stock Market Index Investor (VTSMX) as a possible option. VTSMX has no Zacks Mutual Fund Rank, but we have been a… [+4362 chars]",0,0.798,0.202,0.5106,1,1,1,0
1704,Is Hartford Multifactor Developed Markets exUS ETF (RODM) a Strong ETF Right Now?,2022-02-15T11:20:11Z,http://www.zacks.com/stock/news/1867530/is-hartford-multifactor-developed-markets-exus-etf-rodm-a-strong-etf-right-now?cid=CS-ENTREPRENEUR-FT-smart_beta_etf-1867530,"Making its debut on 02/25/2015, smart beta exchange traded fund Hartford Multifactor Developed Markets exUS ETF (RODM) provides investors broad exposure to the Broad Developed World ETFs category of … [+4644 chars]",0,0.769,0.231,0.5106,1,1,1,0
1705,LIVE MARKETS Not so SWIFT yet - why the West is not yet ready to use its sharpest sanctions? - Reuters,2022-02-25T15:26:00Z,https://www.reuters.com/markets/asia/live-markets-not-so-swift-yet-why-west-is-not-yet-ready-use-its-sharpest-2022-02-25/,"Feb 25 - Welcome to the home for real-time coverage of markets brought to you by Reuters reporters. You can share your thoughts with us at markets.research@thomsonreuters.com
NOT SO SWIFT YET - WHY … [+5084 chars]",0.22,0.78,0,-0.5858,-1,-1,1,0
1706,Should Value Investors Consider Novartis (NVS) Stock Now?,2022-02-17T08:05:00Z,http://www.zacks.com/stock/news/1868842/should-value-investors-consider-novartis-nvs-stock-now?cid=CS-ENTREPRENEUR-FT-analyst_blog|value_stocks-1868842,"Value investing is easily one of the most popular ways to find great stocks in any market environment. After all, who wouldnt want to find stocks that are either flying under the radar and are compel… [+5401 chars]",0,0.745,0.255,0.34,1,0,1,0
1707,"LIVE MARKETS The A's have it: Apple, Amazon, Amgen boost Wall Street - Reuters",2022-02-08T21:33:00Z,https://www.reuters.com/markets/asia/live-markets-as-have-it-apple-amazon-amgen-boost-wall-street-2022-02-08/,"Feb 8 - Welcome to the home for real-time coverage of markets brought to you by Reuters reporters. You can share your thoughts with us at markets.research@thomsonreuters.com
THE A'S HAVE IT: APPLE, … [+14177 chars]",0,0.714,0.286,0.5267,1,0,1,0
1708,LIVE MARKETS UMich: Consumer attitudes head south for the winter - Reuters,2022-02-11T16:35:00Z,https://www.reuters.com/markets/asia/live-markets-umich-consumer-attitudes-head-south-winter-2022-02-11/,"Feb 11 - Welcome to the home for real-time coverage of markets brought to you by Reuters reporters. You can share your thoughts with us at markets.research@thomsonreuters.com
UMICH: CONSUMER ATTITUD… [+6886 chars]",0,1,0,0,0,-1,1,0
1709,LIVE MARKETS Could inflation surge be enough to tip US into recession? - Reuters,2022-02-24T16:06:00Z,https://www.reuters.com/markets/asia/live-markets-could-inflation-surge-be-enough-tip-us-into-recession-2022-02-24/,"Feb 24 - Welcome to the home for real-time coverage of markets brought to you by Reuters reporters. You can share your thoughts with us at markets.research@thomsonreuters.com
COULD INFLATION SURGE B… [+6614 chars]",0.189,0.811,0,-0.4215,-1,-1,1,0
1710,Is Principal U.S. MegaCap ETF (USMC) a Strong ETF Right Now?,2022-02-08T11:20:09Z,http://www.zacks.com/stock/news/1863849/is-principal-u-s-megacap-etf-usmc-a-strong-etf-right-now?cid=CS-ENTREPRENEUR-FT-smart_beta_etf-1863849,"The Principal U.S. MegaCap ETF (USMC) was launched on 10/12/2017, and is a smart beta exchange traded fund designed to offer broad exposure to the Style Box - Large Cap Blend category of the market.
… [+4792 chars]",0,0.732,0.268,0.5106,1,1,1,0
1711,VPG vs. CAMP: Which Stock Should Value Investors Buy Now?,2022-02-18T16:40:10Z,http://www.zacks.com/stock/news/1870048/vpg-vs-camp-which-stock-should-value-investors-buy-now?cid=CS-ENTREPRENEUR-FT-tale_of_the_tape|yseop_template_3-1870048,Investors looking for stocks in the Electronics - Miscellaneous Components sector might want to consider either Vishay Precision (VPG) or CalAmp (CAMP). But which of these two stocks is more attracti… [+3010 chars],0,0.789,0.211,0.34,1,0,1,0
1712,CX or MLM: Which Is the Better Value Stock Right Now?,2022-02-15T16:40:10Z,http://www.zacks.com/stock/news/1867872/cx-or-mlm-which-is-the-better-value-stock-right-now?cid=CS-ENTREPRENEUR-FT-tale_of_the_tape|yseop_template_3-1867872,Investors looking for stocks in the Building Products - Concrete and Aggregates sector might want to consider either Cemex (CX) or Martin Marietta (MLM). But which of these two stocks presents invest… [+3160 chars],0.191,0.487,0.323,0.2885,1,0,1,0
1713,LIVE MARKETS Wall Street ends sharply lower as war fears increase - Reuters,2022-02-17T21:11:00Z,https://www.reuters.com/markets/asia/live-markets-wall-street-ends-sharply-lower-war-fears-increase-2022-02-17/,"Feb 17 - Welcome to the home for real-time coverage of markets brought to you by Reuters reporters. You can share your thoughts with us at markets.research@thomsonreuters.com
WALL STREET ENDS SHARPL… [+12923 chars]",0.464,0.417,0.12,-0.765,-1,-1,1,0
1714,SNDR vs. ZTO: Which Stock Is the Better Value Option?,2022-02-18T16:40:11Z,http://www.zacks.com/stock/news/1870046/sndr-vs-zto-which-stock-is-the-better-value-option?cid=CS-ENTREPRENEUR-FT-tale_of_the_tape|yseop_template_3-1870046,Investors looking for stocks in the Transportation - Services sector might want to consider either Schneider National (SNDR) or ZTO Express Cayman Inc. (ZTO). But which of these two stocks offers val… [+3195 chars],0,0.602,0.398,0.6486,1,0,1,0
1715,LIVE MARKETS Yield curve inversion might not be as scary as thought - Reuters,2022-02-18T18:04:00Z,https://www.reuters.com/markets/asia/live-markets-yield-curve-inversion-might-not-be-scary-thought-2022-02-18/,"Feb 18 - Welcome to the home for real-time coverage of markets brought to you by Reuters reporters. You can share your thoughts with us at markets.research@thomsonreuters.com
YIELD CURVE INVERSION M… [+12045 chars]",0,0.82,0.18,0.3875,1,0,1,0
1716,Is Schwab Fundamental International Large Company Index ETF (FNDF) a Strong ETF Right Now?,2022-02-28T11:20:09Z,http://www.zacks.com/stock/news/1874178/is-schwab-fundamental-international-large-company-index-etf-fndf-a-strong-etf-right-now?cid=CS-ENTREPRENEUR-FT-smart_beta_etf-1874178,"The Schwab Fundamental International Large Company Index ETF (FNDF) was launched on 08/13/2013, and is a smart beta exchange traded fund designed to offer broad exposure to the Broad Developed World … [+4709 chars]",0,0.784,0.216,0.5106,1,1,1,0
1717,LIVE MARKETS Wall Street ends week higher after sour rumblings - Reuters,2022-02-04T21:22:00Z,https://www.reuters.com/markets/asia/live-markets-wall-street-ends-week-higher-after-sour-rumblings-2022-02-04/,"Feb 4 - Welcome to the home for real-time coverage of markets brought to you by Reuters reporters. You can share your thoughts with us at markets.research@thomsonreuters.com
WALL STREET ENDS WEEK HI… [+13943 chars]",0,1,0,0,0,1,1,0
1718,LIVE MARKETS Worst day since COVID-19 crash for euro zone banks - Reuters,2022-02-24T17:03:00Z,https://www.reuters.com/markets/asia/live-markets-worst-day-since-covid-19-crash-euro-zone-banks-2022-02-24/,"Feb 24 - Welcome to the home for real-time coverage of markets brought to you by Reuters reporters. You can share your thoughts with us at markets.research@thomsonreuters.com
WORST DAY SINCE COVID-1… [+7768 chars]",0.405,0.595,0,-0.7783,-1,-1,1,0
1719,"Samsung Galaxy S22 series comes with Google Messages in US, pre-installed as default messaging app - News9 Live",2022-02-15T07:20:36Z,https://www.news9live.com/technology/mobile-phone/samsung-galaxy-s22-series-comes-with-google-messages-pre-installed-as-default-messaging-app-153704,"In the United States, the latest Samsung Galaxy S22 series smartphones come pre-installed with Google Messages as the default messaging app. Google Messages app supports Rich Communication Services (… [+1559 chars]",0,1,0,0,0,0,1,0
1720,LIVE MARKETS A week of war - Reuters.com,2022-03-04T07:57:00Z,https://www.reuters.com/markets/asia/live-markets-week-war-2022-03-04/,"March 4 - Welcome to the home for real-time coverage of markets brought to you by Reuters reporters. You can share your thoughts with us at markets.research@thomsonreuters.com
A WEEK OF WAR (0757 GM… [+3556 chars]",0.438,0.562,0,-0.5994,-1,-1,1,0
1721,LIVE MARKETS Retail to the rescue - Reuters,2022-02-09T09:50:00Z,https://www.reuters.com/markets/stocks/live-markets-retail-rescue-2022-02-09/,"Feb 9 - Welcome to the home for real-time coverage of markets brought to you by Reuters reporters. You can share your thoughts with us at markets.research@thomsonreuters.com
RETAIL TO THE RESCUE (09… [+4954 chars]",0,0.645,0.355,0.5106,1,0,1,0
