Column1,title,publishedAt,url,content,vader_neg,vader_neu,vader_pos,vader_comp,vader_label,label,include,relevant
1059,Indian rupee opens on flat note against US dollar in early trade,2022-02-18T05:13:55Z,https://www.moneycontrol.com/news/business/markets/indian-rupee-opens-on-flat-note-against-us-dollar-in-early-trade-8128231.html,"At the interbank foreign exchange, the rupee witnessed range-bound trade as it opened at 75.03 against the US dollar, saw an early high of 75.02 and a low of 75.05 against its previous close of 75.06.",0,1,0,0,0,0,1,0
1060,Why Banks' Balance Sheets Are In Better Shape,2022-01-26T04:35:00Z,https://seekingalpha.com/article/4481642-why-banks-balance-sheets-are-in-better-shape,The COVID-19 pandemic looked set to batter the world’s banks - and yet banks’ balance sheets are now the strongest they’ve been since the global financial crisis (GFC).,0,0.707,0.293,0.4404,1,1,1,0
1061,Northern Trust Asset Management’s FlexShares® Expands Listing of Private Equity ETF,2022-02-07T08:08:59Z,https://www.businesswire.com/news/home/20220207005259/en/Northern-Trust-Asset-Management%E2%80%99s-FlexShares%C2%AE-Expands-Listing-of-Private-Equity-ETF,"LONDON--(BUSINESS WIRE)--Northern Trust Asset Management’s FlexShares Exchange Traded Funds today announced the listing of the FlexShares® Listed Private Equity UCITS ETF (Ticker: FLPE), the firm’s first exchange traded fund (ETF) that offers investors direct…",0,0.526,0.474,0.7351,1,1,1,0
1062,Indian rupee slumps 24 paise to 74.79 against US dollar in early trade,2022-02-22T05:19:56Z,https://www.moneycontrol.com/news/business/markets/indian-rupee-slumps-24-paise-to-74-79-against-us-dollar-in-early-trade-8146181.html,"Forex traders said sustained foreign fund outflows, a lacklustre trend in domestic equities and elevated crude oil prices weighed on investor sentiment.",0,1,0,0,0,-1,1,0
1063,Nigeria looks to Europe for funding as Chinese lenders move away from costly projects in Africa,2022-02-05T09:30:00Z,https://finance.yahoo.com/news/nigeria-looks-europe-funding-chinese-093000782.html,"Nigeria is looking to Europe for funding to complete infrastructure projects such as railways, with a senior official in the West African nation saying...",0.085,0.915,0,-0.1027,-1,1,1,1
1064,Startup Genome Releases Global Startup Ecosystem Report: Cleantech Edition,2022-02-01T18:06:20Z,https://cleantechnica.com/2022/02/01/startup-genome-releases-global-startup-ecosystem-report-cleantech-edition/,"Startup Genome launched its report, Global Startup Ecosystem Report: Cleantech Edition, at CleanTech Forum San Francisco. Founder & CEO of Startup Genome, JF Gauthier, introduced the report, noting that it’s the world’s most comprehensive and widely read rese…",0,1,0,0,0,0,1,0
1065,The Cannabinoid Derived Pharmaceutical Market worth US$ 11.2 Billion by 2030 - Exclusive Report by InsightAce Analytic,2022-02-03T11:00:00Z,https://finance.yahoo.com/news/cannabinoid-derived-pharmaceutical-market-worth-110000035.html,"The newly published report titled ""Global Cannabinoid Derived Pharmaceutical Market – By Trends, Industry Competition Analysis, Pipeline Analysis, COVID-19...",0,0.805,0.195,0.34,1,1,1,0
1066,Rupee gains 18 paise to 75.14 against US dollar in early trade,2022-02-16T05:32:29Z,https://www.moneycontrol.com/news/business/economy/rupee-gains-18-paise-to-75-14-against-us-dollar-in-early-trade-8108891.html,"At the interbank foreign exchange, the rupee opened at 75.24 against the American dollar and then inched higher to quote 75.14, registering a rise of 18 paise from the last close.",0,0.821,0.179,0.34,1,1,1,0
1067,The 50 Biggest US Donors Gave or Pledged Nearly $28 Billion in 2021 – Bill Gates and Melinda French Gates Account for $15 Billion of That Tota,2022-02-09T11:46:06Z,https://www.nakedcapitalism.com/2022/02/the-50-biggest-us-donors-gave-or-pledged-nearly-28-billion-in-2021-bill-gates-and-melinda-french-gates-account-for-15-billion-of-that-tota.html,"No, you are not paranoid if you worry about the outsized influence of the Gates Foundation.",0,1,0,0,0,0,1,0
1068,MSCI (MSCI) Q4 2021 Earnings Call Transcript,2022-01-28T00:30:28Z,https://www.fool.com/earnings/call-transcripts/2022/01/27/msci-msci-q4-2021-earnings-call-transcript/,"MSCI earnings call for the period ending December 31, 2021.",0,1,0,0,0,0,1,0
1069,Public human microbiome data are dominated by highly developed countries,2022-02-15T14:00:00Z,https://journals.plos.org/plosbiology/article?id=10.1371/journal.pbio.3001536,"The importance of sampling from globally representative populations has been well established in human genomics, but what about the microbiome? This study shows that metadata from almost half a million samples reveals worldwide human microbiome research is sk…",0,1,0,0,0,0,0,0
1070,Global X Expands its Product Lineup in Europe with Launch of Three Innovative UCITS ETFs,2022-02-17T09:30:00Z,https://finance.yahoo.com/news/global-x-expands-product-lineup-093000944.html,"Global X ETFs, a leading global provider of exchange-traded funds (ETFs), today announced the launch of three new European UCITS ETFs, listed on London Stock...",0,0.736,0.264,0.5106,1,0,1,0
1071,"This Week in European Tech: Cazoo grabs $630M in funding, GoCardless a $2.1B valuation, Apple, Samsung and Bumble acquire startups, and much more - Tech.eu",2022-02-11T15:25:21Z,https://tech.eu/2022/02/11/this-week-in-european-tech-x,"Happy Friday!
This week, the Tech.eu research team tracked more than 100 tech funding deals worth over €1.3 billion, and almost 20 exits, M&A transactions, and rumours, and related news stories across Europe, including Russia and Turkey.
As always, we are p…",0,1,0,0,0,1,1,0
1072,Liquidnet Expands ETF Capabilities in the US,2022-02-03T13:42:04Z,https://www.businesswire.com/news/home/20220303005001/en/Liquidnet-Expands-ETF-Capabilities-in-the-US%C2%A0,"NEW YORK--(BUSINESS WIRE)--Liquidnet, a leading global agency broker, today announced the expansion of its Exchange Traded Fund (ETF) capabilities in the US with an unconflicted solution to trade ETFs in the region. This announcement follows the launch of the…",0,0.811,0.189,0.1027,1,1,1,0
1073,"Acuity Knowledge Partners Survey Reveals Optimistic Outlook for Private Equity and Venture Capital, Despite Rising Competition",2022-02-17T10:07:46Z,https://www.businesswire.com/news/home/20220216006266/en/Acuity-Knowledge-Partners-Survey-Reveals-Optimistic-Outlook-for-Private-Equity-and-Venture-Capital-Despite-Rising-Competition,LONDON--(BUSINESS WIRE)--Acuity Knowledge Partners today released findings from its global Private Equity and Venture Capital survey.,0,0.867,0.133,0.3182,1,1,1,0
1074,JPMorgan Turns Bullish on These 2 Stocks; Sees at Least 40% Upside Potential,2022-02-01T23:00:09Z,https://finance.yahoo.com/news/jpmorgan-turns-bullish-2-stocks-230009032.html,What to make of the markets today? Volatility is way up. January brought us a market correction to start out 2022 – but then the last three trading sessions ...,0,1,0,0,0,0,1,0
1075,Three Brilliant Women Scientists Empower Positive Change Through Amazon Sustainability Data Initiative,2022-02-11T18:05:27Z,https://www.forbes.com/sites/carolinamilanesi/2022/02/11/three-brilliant-women-scientists-empower-positive-change-through-amazon-sustainability-data-initiative/,"To commemorate International Day of Women and Girls in Science, I spoke to the global lead for Amazon Sustainability Data Initiative (ASDI) about the need to make data access equitable",0,0.497,0.503,0.8442,1,1,1,0
1076,LIVE MARKETS Russia/Ukraine: scanning Europe for stress - Reuters,2022-01-27T12:34:00Z,https://www.reuters.com/markets/stocks/live-markets-russiaukraine-scanning-europe-stress-2022-01-27/,"Welcome to the home for real-time coverage of markets brought to you by Reuters reporters. You can share your thoughts with us at <a href=""mailto:markets.research@thomsonreuters.com"" target=""_blank"">markets.research@thomsonreuters.com</a>",0.286,0.714,0,-0.4215,-1,-1,1,1
1077,Analysis: Where now after 2% yield? Bond investors take stock - Reuters,2022-02-10T15:53:00Z,https://www.reuters.com/business/where-now-after-2-yield-bond-investors-take-stock-2022-02-10/,"U.S. Treasury yields have shot higher this year, rising faster than many forecast. Investors are now assessing if anticipation of a more hawkish Fed will continue to push levels up, with the potential to upset riskier assets.",0,1,0,0,0,0,1,0
1078,"Zacks Investment Ideas feature highlights: Deere & Co., Titan International Inc. and AGCO Corp",2022-02-14T09:11:00Z,http://www.zacks.com/stock/news/1866852/zacks-investment-ideas-feature-highlights-deere-co-titan-international-inc-and-agco-corp?cid=CS-ENTREPRENEUR-FT-press_releases-1866852,"Deere & Co., Titan International Inc. and AGCO Corp. are highlighted in this Investment Ideas article.",0,1,0,0,0,0,1,0
1079,"Zacks Investment Ideas feature highlights: Philip Morris International Inc., Altria Group, Inc. and British American Tobacco p.l.c",2022-02-16T09:45:00Z,http://www.zacks.com/stock/news/1868166/zacks-investment-ideas-feature-highlights-philip-morris-international-inc-altria-group-inc-and-british-american-tobacco-p-l-c?cid=CS-ENTREPRENEUR-FT-press_releases-1868166,"Philip Morris International Inc., Altria Group, Inc. and British American Tobacco p.l.c are highlighted in this Investment Ideas article.",0,1,0,0,0,0,1,0
1080,LIVE MARKETS Stocks to hedge inflation - Reuters,2022-02-16T13:01:00Z,https://www.reuters.com/markets/stocks/live-markets-stocks-hedge-inflation-2022-02-16/,"Welcome to the home for real-time coverage of markets brought to you by Reuters reporters. You can share your thoughts with us at <a href=""mailto:markets.research@thomsonreuters.com"" target=""_blank"">markets.research@thomsonreuters.com</a>",0,1,0,0,0,0,1,0
1081,LIVE MARKETS A different equity market - Reuters,2022-02-23T09:07:00Z,https://www.reuters.com/markets/stocks/live-markets-different-equity-market-2022-02-23/,"Welcome to the home for real-time coverage of markets brought to you by Reuters reporters. You can share your thoughts with us at <a href=""mailto:markets.research@thomsonreuters.com"" target=""_blank"">markets.research@thomsonreuters.com</a>",0,1,0,0,0,0,1,0
1082,ETF Strategies to Consider for February as Fed's Rate Hike Nears,2022-02-07T21:00:00Z,http://www.zacks.com/stock/news/1863660/etf-strategies-to-consider-for-february-as-fed-s-rate-hike-nears?cid=CS-ENTREPRENEUR-FT-etf_news_and_commentary-1863660,Here we highlight a few ETF options considering the different investment environment conditions that investors might encounter in February.,0,1,0,0,0,0,1,0
1083,LIVE MARKETS Forget the Fed put - Reuters,2022-01-27T10:26:00Z,https://www.reuters.com/markets/stocks/live-markets-forget-fed-put-2022-01-27/,"Welcome to the home for real-time coverage of markets brought to you by Reuters reporters. You can share your thoughts with us at <a href=""mailto:markets.research@thomsonreuters.com"" target=""_blank"">markets.research@thomsonreuters.com</a>",0.241,0.759,0,-0.2263,-1,-1,1,0
1084,LIVE MARKETS Tightening cycle: no alarms and no surprises please - Reuters,2022-01-31T11:31:00Z,https://www.reuters.com/markets/stocks/live-markets-tightening-cycle-no-alarms-no-surprises-please-2022-01-31/,"Welcome to the home for real-time coverage of markets brought to you by Reuters reporters. You can share your thoughts with us at <a href=""mailto:markets.research@thomsonreuters.com"" target=""_blank"">markets.research@thomsonreuters.com</a>",0.389,0.359,0.251,-0.3182,-1,-1,1,0
1085,"Zacks Industry Outlook Highlights ConocoPhillips, Occidental Petroleum, Hess Corp and Marathon Oil Corp",2022-02-09T15:42:00Z,http://www.zacks.com/stock/news/1864902/zacks-industry-outlook-highlights-conocophillips-occidental-petroleum-hess-corp-and-marathon-oil-corp?cid=CS-ENTREPRENEUR-FT-press_releases-1864902,"ConocoPhillips, Occidental Petroleum, Hess Corp and Marathon Oil Corp are included in this Industry Outlook blog",0,1,0,0,0,0,1,0
1086,LIVE MARKETS Italy's vote: Mattarella on the BTP-positive side - Reuters,2022-01-27T13:09:00Z,https://www.reuters.com/markets/stocks/live-markets-italys-vote-mattarella-btp-positive-side-2022-01-27/,"Welcome to the home for real-time coverage of markets brought to you by Reuters reporters. You can share your thoughts with us at <a href=""mailto:markets.research@thomsonreuters.com"" target=""_blank"">markets.research@thomsonreuters.com</a>",0,1,0,0,0,0,1,0
1087,LIVE MARKETS Beware: Risky stocks just got riskier - Reuters,2022-01-27T13:50:00Z,https://www.reuters.com/markets/stocks/live-markets-beware-risky-stocks-just-got-riskier-2022-01-27/,"Welcome to the home for real-time coverage of markets brought to you by Reuters reporters. You can share your thoughts with us at <a href=""mailto:markets.research@thomsonreuters.com"" target=""_blank"">markets.research@thomsonreuters.com</a>",0.375,0.625,0,-0.4939,-1,-1,1,0
1088,"Zacks.com featured highlights include: Packaging Corp. of America, Louisiana-Pacific Corp., Houlihan Lokey, and Equinor ASA",2022-02-04T09:06:00Z,http://www.zacks.com/stock/news/1862535/zacks-com-featured-highlights-include-packaging-corp-of-america-louisiana-pacific-corp-houlihan-lokey-and-equinor-asa?cid=CS-ENTREPRENEUR-FT-press_releases-1862535,"Packaging Corp. of America, Louisiana-Pacific Corp., Houlihan Lokey, and Equinor ASA are highlighted in this Screen of the Week article.",0,1,0,0,0,0,0,0
1089,"Zacks Industry Outlook Highlights: Stanley Black & Decker, Inc., Lincoln Electric Holdings, Inc. and Kennametal Inc",2022-02-14T09:28:00Z,http://www.zacks.com/stock/news/1866855/zacks-industry-outlook-highlights-stanley-black-decker-inc-lincoln-electric-holdings-inc-and-kennametal-inc?cid=CS-ENTREPRENEUR-FT-press_releases-1866855,"Stanley Black & Decker, Inc., Lincoln Electric Holdings, Inc. and Kennametal Inc. are highlighted in this Industry Outlook article.",0,1,0,0,0,0,1,0
1090,LIVE MARKETS Bears in charge due to inflation worries - Reuters,2022-01-31T11:52:00Z,https://www.reuters.com/markets/stocks/live-markets-bears-charge-due-inflation-worries-2022-01-31/,"Welcome to the home for real-time coverage of markets brought to you by Reuters reporters. You can share your thoughts with us at <a href=""mailto:markets.research@thomsonreuters.com"" target=""_blank"">markets.research@thomsonreuters.com</a>",0.237,0.763,0,-0.4215,-1,-1,1,0
1091,Russia-Ukraine Tensions Flare Up: ETF Strategies to Win,2022-02-22T18:00:00Z,http://www.zacks.com/stock/news/1871375/russia-ukraine-tensions-flare-up-etf-strategies-to-win?cid=CS-ENTREPRENEUR-FT-etf_news_and_commentary-1871375,"Geopolitical tensions related to Russia and Ukraine continue to linger. As a result, the major U.S. equity indices slumped on Friday to end a second straight week of losses.",0.216,0.48,0.304,0.2732,1,1,1,0
1092,"Zacks Industry Outlook Highlights Axcelis Technologies, Entegris and Veeco Instruments",2022-02-22T16:43:00Z,http://www.zacks.com/stock/news/1871320/zacks-industry-outlook-highlights-axcelis-technologies-entegris-and-veeco-instruments?cid=CS-ENTREPRENEUR-FT-press_releases-1871320,"Axcelis Technologies, Entegris and Veeco Instruments are included in this blog.",0,1,0,0,0,0,1,0
1093,Italy telco deal would open European floodgates - Reuters,2022-01-25T13:03:00Z,https://www.reuters.com/breakingviews/italy-telco-deal-would-open-european-floodgates-2022-01-25/,"The Italian leg of Iliad’s long journey as a telecoms upstart may be nearing its conclusion. French tycoon Xavier Niel’s local outfit is in merger talks with Britain’s Vodafone <a href=""https://www.reuters.com/companies/VOD.L"" target=""_blank"">(VOD.L)</a> to r…",0,1,0,0,0,0,1,0
1094,"Zacks Industry Outlook Highlights: Ryder System, GATX Corp. and Trinity Industries",2022-02-04T08:48:00Z,http://www.zacks.com/stock/news/1862532/zacks-industry-outlook-highlights-ryder-system-gatx-corp-and-trinity-industries?cid=CS-ENTREPRENEUR-FT-press_releases-1862532,"Ryder System, GATX Corp. and Trinity Industries are highlighted in this Industry Outlook article.",0,1,0,0,0,0,1,0
1095,MarineMax and Atlassian highlighted as Zacks Bull and Bear of the Day,2022-02-03T10:15:00Z,http://www.zacks.com/stock/news/1861778/marinemax-and-atlassian-highlighted-as-zacks-bull-and-bear-of-the-day?cid=CS-ENTREPRENEUR-FT-press_releases-1861778,MarineMax and Atlassian highlighted as Zacks Bull and Bear of the Day.,0,1,0,0,0,0,1,0
1096,Where did VC investment grow the fastest in 2021?,2022-02-11T13:04:50Z,https://qz.com/africa/2126317/vc-funding-for-african-tech-startups-hit-a-record-high-in-2021/,"Venture capital reached new highs in Africa, Latin America, the US, Europe, and Asia in 2021.",0,1,0,0,0,0,1,0
1097,"Zacks Industry Outlook Highlights: Vermilion Energy, Capricorn Energy, Tullow Oil and VAALCO Energy",2022-02-02T09:24:00Z,http://www.zacks.com/stock/news/1861034/zacks-industry-outlook-highlights-vermilion-energy-capricorn-energy-tullow-oil-and-vaalco-energy?cid=CS-ENTREPRENEUR-FT-press_releases-1861034,"Vermilion Energy, Capricorn Energy, Tullow Oil and VAALCO Energy are highlighted in this Industry Outlook article.",0,0.613,0.387,0.6486,1,0,1,0
1098,"Zacks Industry Outlook Highlights: CBRE Group, Jones Lang LaSalle and Cushman & Wakefield",2022-02-08T15:41:00Z,http://www.zacks.com/stock/news/1864149/zacks-industry-outlook-highlights-cbre-group-jones-lang-lasalle-and-cushman-wakefield?cid=CS-ENTREPRENEUR-FT-press_releases-1864149,"CBRE Group, Jones Lang LaSalle and Cushman & Wakefield are included in this Industry Outlook blog.",0,1,0,0,0,0,1,0
1099,"Zacks Industry Outlook Highlights: NetApp, Western Digital and Pure Storage",2022-02-03T09:42:00Z,http://www.zacks.com/stock/news/1861768/zacks-industry-outlook-highlights-netapp-western-digital-and-pure-storage?cid=CS-ENTREPRENEUR-FT-press_releases-1861768,"NetApp, Western Digital and Pure Storage are highlighted in this Industry Outlook article.",0,1,0,0,0,0,1,0
1100,"The Zacks Analyst Blog Highlights: iShares S&P 500 Value ETF, Invesco KBW Bank ETF, SPDR S&P Retail ETF, The Energy Select Sector SPDR Fund and VanEck Semiconductor ETF",2022-02-01T10:05:00Z,http://www.zacks.com/stock/news/1860315/the-zacks-analyst-blog-highlights-ishares-s-p-500-value-etf-invesco-kbw-bank-etf-spdr-s-p-retail-etf-the-energy-select-sector-spdr-fund-and-vaneck-semiconductor-etf?cid=CS-ENTREPRENEUR-FT-press_releases-1860315,"iShares S&P 500 Value ETF, Invesco KBW Bank ETF, SPDR S&P Retail ETF, The Energy Select Sector SPDR Fund and VanEck Semiconductor ETF are highlighted kin this Analyst Blog article.",0,0.852,0.148,0.5423,1,1,1,0
1101,3 Stocks To Tap The Semiconductor-General Industry Potential,2022-02-18T20:53:00Z,http://www.zacks.com/commentary/1870105/3-stocks-to-tap-the-semiconductor-general-industry-potential?cid=CS-ENTREPRENEUR-FT-industry_outlook-1870105,"Secular growth prospects makes the Semiconductor ??? General industry a good place to bet on. STM, TXN and NVDA are our picks.",0,1,0,0,0,0,1,0
1102,Bet on These 5 Top-Ranked ETFs Amid Tough Market Conditions,2022-01-31T19:10:00Z,http://www.zacks.com/stock/news/1860140/bet-on-these-5-top-ranked-etfs-amid-tough-market-conditions?cid=CS-ENTREPRENEUR-FT-etf_news_and_commentary-1860140,Let's take a look at some top-ranked ETFs that investors can consider to sail through the current market conditions.,0.158,0.842,0,-0.128,-1,0,1,0
1103,Why stockmarket jitters have not so far spread to the credit market,2022-02-03T16:20:06Z,https://www.economist.com/finance-and-economics/2022/02/04/why-stockmarket-jitters-have-not-so-far-spread-to-the-credit-market,"Bond-holders tend to be less starry-eyed than stock investors. Still, there are reasons to be watchful",0,0.809,0.191,0.3818,1,1,1,0
1104,"3 Mega-Cap Stocks Wall Street Loves: Nike, Alphabet, and Meta",2022-02-03T12:52:22Z,https://stocknews.com/news/googl-fb-nke-3-mega-cap-stocks-wall-street-loves-nike-alphabet-and-meta/,"Mega-cap stocks, such as Alphabet (GOOGL), Meta Platforms (FB), and Nike (NKE), are generally considered all-weather stocks due to their ability to endure harsh economic downturns and protect investors from...",0,0.684,0.316,0.5719,1,1,1,0
1105,Why stockmarket jitters have not so far spread to the credit market,2022-02-03T11:23:30Z,https://www.economist.com/finance-and-economics/2022/02/05/why-stockmarket-jitters-have-not-so-far-spread-to-the-credit-market,"Bond-holders tend to be less starry-eyed than stock investors. Still, there are reasons to be watchful",0,0.809,0.191,0.3818,1,1,1,0
1106,America prepares the “mother of all sanctions” against Russia,2022-02-01T00:00:00Z,https://www.economist.com/finance-and-economics/america-prepares-the-mother-of-all-sanctions-against-russia/21807487,How much would they hurt?,0,1,0,0,0,-1,1,1
1107,America prepares the “mother of all sanctions” against Russia,2022-02-01T00:00:00Z,https://www.economist.com/finance-and-economics/2022/02/01/america-prepares-the-mother-of-all-sanctions-against-russia,How much would they hurt?,0,1,0,0,0,-1,1,1
1108,How Venture Capital Made the Modern World (with Sebastian Mallaby),2022-02-09T14:00:00Z,https://hbr.org/podcast/2022/02/how-venture-capital-made-the-modern-world-with-sebastian-mallaby,Journalist and author Sebastian Mallaby joins Azeem Azhar to discuss the history (and future) of venture capital.,0,1,0,0,0,0,1,1
1109,Here are 10 reasons why space exploration benefits Earth,2022-01-22T15:00:35Z,https://thenextweb.com/news/10-ways-space-exploration-benefits-earth-syndication,Space exploration benefits Earth and everyone living on it in ways most people never expect — Here’s 10 reasons why investing in space is our best hope for humanity. Space exploration is the grandest endeavor the human race has ever undertaken. Reaching out b…,0,0.609,0.391,0.5423,1,0,0,0
1110,What the West Will Never Understand About Putin’s Ukraine Obsession,2022-01-22T15:15:14Z,https://time.com/6140996/putin-ukraine-threats/,"The way Russian President Vladimir Putin and Kremlin propaganda talk about the countries Russia threatens—with Ukraine front and center—to invade, occupy, coerce and control tells the story of perhaps the unhappiest family in the world. Reading Putin’s mind i…",0.211,0.789,0,-0.34,-1,0,1,0
1111,Cisco Systems Is A Buy,2022-02-05T05:03:38Z,https://seekingalpha.com/article/4484603-cisco-systems-is-a-buy,"Cisco is a core tech company, with great company financials. Read more to know if CSCO stock’s fundamental analysis says this is a great investment.",0,1,0,0,0,0,0,0
1112,Links 1/26/2021,2022-01-26T11:55:13Z,https://www.nakedcapitalism.com/2022/01/links-1-26-2021-2.html,"Our oracular daily links: ferret murder, vanishing iceberg, medical corruptoins. magnesium v. cancer, Covid BA.2 hypertransmission, Omicron daily deaths = Delta, Germany test shortage, Truss Brexit contracitions. Europe tries to deescalate Ukraine, US carrier…",0,1,0,0,0,0,0,0
1113,Links 1/26/2022,2022-01-26T11:55:13Z,https://www.nakedcapitalism.com/2022/01/links-1-26-2022.html,"Our oracular daily links: ferret murder, vanishing iceberg, medical corruptoins. magnesium v. cancer, Covid BA.2 hypertransmission, Omicron daily deaths = Delta, Germany test shortage, Truss Brexit contracitions. Europe tries to deescalate Ukraine, US carrier…",0,1,0,0,0,0,0,0
1114,Why Oil Is Nudging US$100/bbl…,2022-02-17T13:31:30Z,https://www.forbes.com/sites/woodmackenzie/2022/02/17/why-oil-is-nudging-us100bbl/,"Brent is trading near an eight-year peak, putting oil once again front and centre for investors, consumers and the global economy. Where does the oil market go from here?",0,1,0,0,0,0,1,0
1115,Europe Buy Now Pay Later Market Report 2022: Fintech Startups are Entering the BNPL Market with Niche Product Offerings,2022-02-21T10:18:00Z,https://finance.yahoo.com/news/europe-buy-now-pay-later-101800083.html,"Dublin, Feb. 21, 2022 (GLOBE NEWSWIRE) -- The ""Europe Buy Now Pay Later Business and Investment Opportunities - 75+ KPIs on Buy Now Pay Later Trends by End...",0.072,0.928,0,-0.1027,-1,-1,1,0
1116,"Financialization of Housing in Europe Is Intensifying, New Report Warns",2022-01-28T11:55:40Z,https://www.nakedcapitalism.com/2022/01/many-parts-of-eu-are-in-the-grip-of-an-insidious-housing-boom-new-report-warns.html,"Since the Global Financial Crisis residential property in European cities has become an attractive asset class for financial institutions, many in the U.S. The virus crisis has merely intensified this trend.",0.135,0.865,0,-0.1027,-1,-1,1,1
1117,The Trade Desk: What You Might Have Missed,2022-02-18T14:49:43Z,https://seekingalpha.com/article/4488319-the-trade-desk-what-you-missed,"The Trade Desk has a very long runway for growth and with a CEO like Jeff Green, it has the drive to keep growing. See a full investment analysis of TTD stock.",0.239,0.761,0,-0.296,-1,0,1,0
1118,"Global ICT Investment in Government Market Size Will Touch USD 695.32 Billion Mark by 2026, at a 6.2% CAGR: Facts & Factors",2022-01-25T15:23:00Z,https://finance.yahoo.com/news/global-ict-investment-government-market-152300660.html,"[179+ Pages Research Study] According to a market research study published by Facts and Factors, the demand analysis of Global ICT Investment in Government...",0,1,0,0,0,1,1,0
1119,Western Europe data center market witnessed investments of USD 35.06 billion in 2021 and will witness investments of USD 44.77 billion by 2027,2022-01-26T11:37:00Z,https://finance.yahoo.com/news/western-europe-data-center-market-113700961.html,In-depth Analysis and Data-driven Insights on the Impact of COVID-19 Included in this Western Europe Data Center Market Report. Western Europe data center...,0,1,0,0,0,1,1,0
