Column1,title,publishedAt,url,content,vader_neg,vader_neu,vader_pos,vader_comp,vader_label,label,include,relevant
526,"Welcome to the home for real-time coverage of markets brought to you by Reuters reporters. You can share your thoughts with us at <a href=""mailto:markets.research@thomsonreuters.com"" target=""_blank"">markets.research@thomsonreuters.com</a>",2022-02-08T15:40:00Z,https://www.reuters.com/markets/asia/live-markets-simmer-down-now-trade-gap-business-sentiment-say-economy-isnt-there-2022-02-08/,"Feb 8 - Welcome to the home for real-time coverage of markets brought to you by Reuters reporters. You can share your thoughts with us at markets.research@thomsonreuters.com
SIMMER DOWN, NOW: TRADE … [+5922 chars]",0,0.822,0.178,0.6369,1,1,1,0
527,"The 5.7% GDP growth in 2021 was the highest since 1984, when Reagan touted the booming economy in his now-famous ""Morning in America"" campaign.",2022-01-27T19:00:36Z,https://www.businessinsider.com/biden-gdp-growth-best-since-reagan-inflation-economic-recovery-1984-2022-1,"It's ""Morning in America"" all over again.
US gross domestic product grew 5.7% through 2021, the Bureau of Economic Analysis announced Thursday morning.
That marks the strongest annual economic grow… [+3561 chars]",0.047,0.853,0.101,0.34,1,1,1,0
528,"Welcome to the home for real-time coverage of markets brought to you by Reuters reporters. You can share your thoughts with us at <a href=""mailto:markets.research@thomsonreuters.com"" target=""_blank"">markets.research@thomsonreuters.com</a>",2022-01-26T16:22:00Z,https://www.reuters.com/markets/asia/live-markets-pre-fed-data-shows-us-economy-nearing-normal-2022-01-26/,"Jan 26 - Welcome to the home for real-time coverage of markets brought to you by Reuters reporters. You can share your thoughts with us at markets.research@thomsonreuters.com
PRE-FED DATA SHOWS U.S.… [+7322 chars]",0,0.822,0.178,0.6369,1,1,1,0
529,"The Consumer Price Index – a popular US inflation yardstick – rose 7.5% year-over-year in January, exceeding the 7.3% median estimate.",2022-02-10T13:36:41Z,https://www.businessinsider.com/inflation-cpi-january-price-growth-report-omicron-wave-supply-chains-2022-2,"New year, same historic inflation.
The Consumer Price Index a commonly used measure of US inflation rose 7.5% year-over-year in January, the Bureau of Labor Statistics announced Thursday morning. Th… [+2189 chars]",0,0.859,0.141,0.4215,1,1,1,0
530,"The U.S. economy <a href=""https://www.reuters.com/business/us-weekly-jobless-claims-drop-more-than-expected-2022-02-03/"" target=""_blank"">created far more jobs than expected in January</a> even as raging COVID-19 infections disrupted activity at consumer-facin…",2022-02-04T13:43:00Z,https://www.reuters.com/business/us-job-growth-beats-expectations-january-unemployment-rate-40-2022-02-04/,"WASHINGTON, Feb 4 (Reuters) - The U.S. economy created far more jobs than expected in January even as raging COVID-19 infections disrupted activity at consumer-facing businesses, pointing to underlyi… [+2805 chars]",0.139,0.861,0,-0.5267,-1,-1,1,0
531,"The number of Americans filing new claims for jobless benefits unexpectedly rose last week, but remained at levels associated with tightening labor market conditions.",2022-02-17T13:40:00Z,https://www.reuters.com/business/us-weekly-jobless-claims-unexpectedly-rise-2022-02-17/,"WASHINGTON, Feb 17 (Reuters) - The number of Americans filing new claims for jobless benefits unexpectedly rose last week, but remained at levels associated with tightening labor market conditions.
… [+2241 chars]",0,0.882,0.118,0.2382,1,-1,1,0
532,"Resolution Foundation report also highlights risk of British firms being undercut by lower cost rivalsGains from a UK trade deal with India could be on a par with those from an agreement with the US but risks exposing the economy to tougher competition, a rep…",2022-01-26T00:01:47Z,https://amp.theguardian.com/business/2022/jan/26/uk-could-gain-first-mover-advantage-with-india-trade-deal,"Gains from a UK trade deal with India could be on a par with those from an agreement with the US but risks exposing the economy to tougher competition, a report says.
The Resolution Foundation think… [+2693 chars]",0.174,0.741,0.085,-0.5106,-1,-1,1,0
533,The US is set to recoup its lost jobs roughly three times faster than during the recovery from the 2008 financial crisis.,2022-02-04T16:52:21Z,https://www.businessinsider.com/january-jobs-report-labor-market-full-recovery-july-hiring-employment-2022-2,"Until early Friday morning, economists expected the Omicron variant to have slammed the brakes on the hiring recovery. The January jobs report not only proved them wrong, but placed a full labor-mark… [+2727 chars]",0.242,0.758,0,-0.7506,-1,-1,1,0
534,Hiring and productivity stayed up despite Omicron gripping America. It's a sign the economy is continuing to mutate along with the coronavirus.,2022-02-04T21:15:31Z,https://www.businessinsider.com/economy-strong-persisting-pandemic-omicron-variant-january-jobs-report-2022-2,"It's been nearly two years of the pandemic, and the economy seems like it's finally adapted.
In January, hiring was unexpectedly strong, with the country adding 467,000 jobs. It was a big surprise: … [+3893 chars]",0,1,0,0,0,0,1,0
535,"Brazil's central bank is set to deliver a third consecutive 150 basis point rate rise on Wednesday in a bid to minimize risks of further capital outflows as the U.S. Federal Reserve gears up to start tightening its own policy, a Reuters poll showed.",2022-01-28T16:13:00Z,https://www.reuters.com/world/americas/brazil-rates-set-soar-further-us-fed-prepares-lift-off-2022-01-28/,"BUENOS AIRES, Jan 28 (Reuters) - Brazil's central bank is set to deliver a third consecutive 150 basis point rate rise on Wednesday in a bid to minimize risks of further capital outflows as the U.S. … [+2791 chars]",0.05,0.95,0,-0.2732,-1,-1,1,0
536,"Top experts are divided on the Fed's rate hikes, Alphabet's stock split, and Bank of America's market forecast.",2022-02-09T11:21:21Z,https://markets.businessinsider.com/news/stocks/10-things-before-the-opening-bell-february-9-2022-2,"Welcome to 10 Things Before the Opening Bell.
If this was forwarded to you, sign up here. Plus, download Insider's app for news on the go click here for iOS andhere for Android.
Let's jump in. 
1.… [+3843 chars]",0,0.904,0.096,0.2023,1,0,1,1
537,"Retail investors are less involved in the market compared to a year ago, Gary Vaynerchuk's NFT forecast, and tips from a 25-year market mentor.",2022-02-14T11:18:53Z,https://markets.businessinsider.com/news/stocks/10-things-before-the-opening-bell-february-14-2022-2,"Welcome to 10 Things Before the Opening Bell.
If this was forwarded to you, sign up here. Plus, download Insider's app for news on the go click here for iOS andhere for Android.
Let's get into it. … [+3470 chars]",0,1,0,0,0,0,1,0
538,"Welcome to the home for real-time coverage of markets brought to you by Reuters reporters. You can share your thoughts with us at <a href=""mailto:markets.research@thomsonreuters.com"" target=""_blank"">markets.research@thomsonreuters.com</a>",2022-02-10T15:20:00Z,https://www.reuters.com/markets/asia/live-markets-wall-street-cools-inflation-data-heats-up-2022-02-10/,"Feb 10 - Welcome to the home for real-time coverage of markets brought to you by Reuters reporters. You can share your thoughts with us at markets.research@thomsonreuters.com
WALL STREET COOLS AS IN… [+2675 chars]",0,0.822,0.178,0.6369,1,0,1,0
539,"An appointment economy is emerging to improve consumer engagement, and field experiences as the globe opens up. So take a moment to check your Calendar and get your appointments scheduled...",2022-01-27T18:00:21Z,https://www.calendar.com/blog/the-appointment-economy-customer-engagement/,"An appointment economy is emerging to improve consumer engagement, and field experiences as the globe opens up. So take a moment to check your Calendar and get your appointments scheduled and up to d… [+8736 chars]",0,0.821,0.179,0.7096,1,1,1,0
540,"U.S. Treasury yields have shot higher this year, rising faster than many forecast. Investors are now assessing if anticipation of a more hawkish Fed will continue to push levels up, with the potential to upset riskier assets.",2022-02-10T15:53:00Z,https://www.reuters.com/business/where-now-after-2-yield-bond-investors-take-stock-2022-02-10/,"NEW YORK, Feb 10 (Reuters) - U.S. Treasury yields have shot higher this year, rising faster than many forecast. Investors are now assessing if anticipation of a more hawkish Fed will continue to push… [+5014 chars]",0.122,0.758,0.12,-0.2732,-1,1,1,1
541,"WASHINGTON — The U.S. economy grew last year at the fastest pace since Ronald Reagan’s presidency, bouncing back with resilience from 2020’s brief but devastating coronavirus recession. The nation’s gross domestic product — its total output of goods and servi…",2022-01-27T15:04:30Z,https://time.com/6143008/2021-us-economy-fast-growth/,"WASHINGTON — The U.S. economy grew last year at the fastest pace since Ronald Reagan’s presidency, bouncing back with resilience from 2020’s brief but devastating coronavirus recession.
The nation’s… [+4021 chars]",0.283,0.717,0,-0.9413,-1,1,1,1
542,"Welcome to the home for real-time coverage of markets brought to you by Reuters reporters. You can share your thoughts with us at <a href=""mailto:markets.research@thomsonreuters.com"" target=""_blank"">markets.research@thomsonreuters.com</a>",2022-02-10T09:10:00Z,https://www.reuters.com/markets/stocks/live-markets-flat-stoxx-covers-big-moves-earnings-2022-02-10/,"Feb 10 - Welcome to the home for real-time coverage of markets brought to you by Reuters reporters. You can share your thoughts with us at markets.research@thomsonreuters.com
FLAT STOXX COVERS BIG M… [+4525 chars]",0,0.822,0.178,0.6369,1,0,1,0
543,"Welcome to the home for real-time coverage of markets brought to you by Reuters reporters. You can share your thoughts with us at <a href=""mailto:markets.research@thomsonreuters.com"" target=""_blank"">markets.research@thomsonreuters.com</a>",2022-02-10T10:41:00Z,https://www.reuters.com/markets/stocks/live-markets-ecb-tapering-scenarios-2022-02-10/,"Feb 10 - Welcome to the home for real-time coverage of markets brought to you by Reuters reporters. You can share your thoughts with us at markets.research@thomsonreuters.com
ECB TAPERING SCENARIOS … [+5923 chars]",0,0.822,0.178,0.6369,1,0,1,0
544,"Jay Powell is facing the challenge of getting the temperature just right. The Federal Reserve boss is likely on Wednesday to signal that interest rates will start rising in March to curb inflation. The robust U.S. economy can cope with that, as well as the th…",2022-01-26T17:20:00Z,https://www.reuters.com/breakingviews/jay-powell-embarks-difficult-goldilocks-act-2022-01-26/,"WASHINGTON, Jan 26 (Reuters Breakingviews) - Jay Powell is facing the challenge of getting the temperature just right. The Federal Reserve boss is likely on Wednesday to signal that interest rates wi… [+3193 chars]",0,0.827,0.173,0.7783,1,1,1,0
545,"Welcome to the home for real-time coverage of markets brought to you by Reuters reporters. You can share your thoughts with us at <a href=""mailto:markets.research@thomsonreuters.com"" target=""_blank"">markets.research@thomsonreuters.com</a>",2022-02-10T17:16:00Z,https://www.reuters.com/markets/asia/live-markets-stocks-off-yields-up-after-cpi-its-not-over-until-its-over-2022-02-10/,"Feb 10 - Welcome to the home for real-time coverage of markets brought to you by Reuters reporters. You can share your thoughts with us at markets.research@thomsonreuters.com
STOCKS OFF, YIELDS UP A… [+8314 chars]",0,0.822,0.178,0.6369,1,0,1,0
546,"Welcome to the home for real-time coverage of markets brought to you by Reuters reporters. You can share your thoughts with us at <a href=""mailto:markets.research@thomsonreuters.com"" target=""_blank"">markets.research@thomsonreuters.com</a>",2022-01-27T18:39:00Z,https://www.reuters.com/markets/asia/live-markets-corporate-profits-are-still-beating-less-impressively-2022-01-27/,"Jan 27 - Welcome to the home for real-time coverage of markets brought to you by Reuters reporters. You can share your thoughts with us at markets.research@thomsonreuters.com
CORPORATE PROFITS ARE S… [+11405 chars]",0,0.822,0.178,0.6369,1,0,1,0
547,"Welcome to the home for real-time coverage of markets brought to you by Reuters reporters. You can share your thoughts with us at <a href=""mailto:markets.research@thomsonreuters.com"" target=""_blank"">markets.research@thomsonreuters.com</a>",2022-01-27T19:01:00Z,https://www.reuters.com/markets/asia/live-markets-fears-esg-hawkish-world-2022-01-27/,"Jan 27 - Welcome to the home for real-time coverage of markets brought to you by Reuters reporters. You can share your thoughts with us at markets.research@thomsonreuters.com
FEARS FOR ESG IN A HAWK… [+12639 chars]",0,0.822,0.178,0.6369,1,0,1,0
548,"Welcome to the home for real-time coverage of markets brought to you by Reuters reporters. You can share your thoughts with us at <a href=""mailto:markets.research@thomsonreuters.com"" target=""_blank"">markets.research@thomsonreuters.com</a>",2022-02-04T19:16:00Z,https://www.reuters.com/markets/asia/live-markets-earnings-outlook-gains-despite-meta-platforms-sour-miss-2022-02-04/,"Feb 4 - Welcome to the home for real-time coverage of markets brought to you by Reuters reporters. You can share your thoughts with us at markets.research@thomsonreuters.com
EARNINGS OUTLOOK GAINS D… [+11798 chars]",0,0.822,0.178,0.6369,1,0,1,0
549,"Welcome to the home for real-time coverage of markets brought to you by Reuters reporters. You can share your thoughts with us at <a href=""mailto:markets.research@thomsonreuters.com"" target=""_blank"">markets.research@thomsonreuters.com</a>",2022-02-10T18:18:00Z,https://www.reuters.com/markets/asia/live-markets-inflation-mentions-surge-q4-earnings-calls-2022-02-10/,"Feb 10 - Welcome to the home for real-time coverage of markets brought to you by Reuters reporters. You can share your thoughts with us at markets.research@thomsonreuters.com
INFLATION MENTIONS SURG… [+10236 chars]",0,0.822,0.178,0.6369,1,0,1,0
550,"Welcome to the home for real-time coverage of markets brought to you by Reuters reporters. You can share your thoughts with us at <a href=""mailto:markets.research@thomsonreuters.com"" target=""_blank"">markets.research@thomsonreuters.com</a>",2022-02-04T21:22:00Z,https://www.reuters.com/markets/asia/live-markets-wall-street-ends-week-higher-after-sour-rumblings-2022-02-04/,"Feb 4 - Welcome to the home for real-time coverage of markets brought to you by Reuters reporters. You can share your thoughts with us at markets.research@thomsonreuters.com
WALL STREET ENDS WEEK HI… [+13943 chars]",0,0.822,0.178,0.6369,1,0,1,0
551,"Welcome to the home for real-time coverage of markets brought to you by Reuters reporters. You can share your thoughts with us at <a href=""mailto:markets.research@thomsonreuters.com"" target=""_blank"">markets.research@thomsonreuters.com</a>",2022-02-10T11:51:00Z,https://www.reuters.com/markets/stocks/live-markets-kryptonite-cpi-2022-02-10/,"Feb 10 - Welcome to the home for real-time coverage of markets brought to you by Reuters reporters. You can share your thoughts with us at markets.research@thomsonreuters.com
KRYPTONITE CPI? (1142 G… [+7331 chars]",0,0.822,0.178,0.6369,1,0,1,0
552,"Canadian firms must follow through with business investment plans, building on shifts made in the COVID-19 pandemic, or risk losing out to competitors south of the border, Bank of Canada Governor Tiff Macklem said on Wednesday.",2022-02-09T17:28:00Z,https://www.reuters.com/business/bank-canada-firms-must-boost-investment-or-lose-us-rivals-2022-02-09/,"OTTAWA, Feb 9 (Reuters) - Canadian firms must follow through with business investment plans, building on shifts made in the COVID-19 pandemic, or risk losing out to competitors south of the border, B… [+2091 chars]",0.121,0.879,0,-0.5719,-1,0,1,0
553,"Greece's tourism minister on Thursday said the visitor season would officially start in March, earlier than previous years, and there were ""positive signs"" of a bumper summer ahead.",2022-02-17T12:07:00Z,https://www.reuters.com/business/healthcare-pharmaceuticals/greece-kicks-off-tourist-season-early-meet-great-demand-2022-02-17/,"ATHENS, Feb 17 (Reuters) - Greece's tourism minister on Thursday said the visitor season would officially start in March, earlier than previous years, and there were ""positive signs"" of a bumper summ… [+2409 chars]",0,0.878,0.122,0.5574,1,1,1,0
554,"Welcome to the home for real-time coverage of markets brought to you by Reuters reporters. You can share your thoughts with us at <a href=""mailto:markets.research@thomsonreuters.com"" target=""_blank"">markets.research@thomsonreuters.com</a>",2022-02-08T16:13:00Z,https://www.reuters.com/markets/asia/live-markets-10-year-yields-test-key-levels-before-supply-inflation-data-2-view-2022-02-08/,"Feb 8 - Welcome to the home for real-time coverage of markets brought to you by Reuters reporters. You can share your thoughts with us at markets.research@thomsonreuters.com
10-YEAR YIELDS TEST KEY … [+7503 chars]",0,0.822,0.178,0.6369,1,0,1,0
555,The recently released U.S. industrial output data seem to be encouraging amid improving labor market and easing pandemic conditions.,2022-02-19T01:44:00Z,http://www.zacks.com/stock/news/1870196/will-etfs-gain-from-improving-us-industrial-output-in-january?cid=CS-ENTREPRENEUR-FT-etf_news_and_commentary-1870196,"The latest data on U.S. industrial output seems to be encouraging amid improving labor market and easing pandemic conditions. Per the Feds recently-released data, total industrial production rose 1.4… [+5424 chars]",0,0.661,0.339,0.802,1,1,1,0
556,"The disappointing consumer confidence reading might affect the consumer discretionary sector, which attracts a major portion of consumer spending amid rising inflation levels.",2022-01-27T20:19:00Z,http://www.zacks.com/stock/news/1858612/will-etfs-suffer-as-us-consumer-confidence-weakens-in-january?cid=CS-ENTREPRENEUR-FT-etf_news_and_commentary-1858612,Consumers seem to be losing their enthusiasm about the recoveries in the labor market and U.S. economy from the pandemic-led slowdown. The Conference Board's measure of consumer confidence index stan… [+4805 chars],0.113,0.674,0.213,0.4215,1,-1,1,0
557,"Welcome to the home for real-time coverage of markets brought to you by Reuters reporters. You can share your thoughts with us at <a href=""mailto:markets.research@thomsonreuters.com"" target=""_blank"">markets.research@thomsonreuters.com</a>",2022-02-08T21:33:00Z,https://www.reuters.com/markets/asia/live-markets-as-have-it-apple-amazon-amgen-boost-wall-street-2022-02-08/,"Feb 8 - Welcome to the home for real-time coverage of markets brought to you by Reuters reporters. You can share your thoughts with us at markets.research@thomsonreuters.com
THE A'S HAVE IT: APPLE, … [+14177 chars]",0,0.822,0.178,0.6369,1,0,1,0
558,"The European Central Bank will raise its deposit rate in the second half of this year, and not wait until 2023 as previously expected, according to a Reuters poll of economists who also sharply upgraded their inflation forecasts for this year.",2022-02-15T04:08:00Z,https://www.reuters.com/world/europe/ecb-raise-deposit-rate-025-by-year-end-2022-02-15/,"BENGALURU, Feb 15 (Reuters) - The European Central Bank will raise its deposit rate in the second half of this year, and not wait until 2023 as previously expected, according to a Reuters poll of eco… [+3593 chars]",0,1,0,0,0,1,1,1
559,"Welcome to the home for real-time coverage of markets brought to you by Reuters reporters. You can share your thoughts with us at <a href=""mailto:markets.research@thomsonreuters.com"" target=""_blank"">markets.research@thomsonreuters.com</a>",2022-01-27T09:20:00Z,https://www.reuters.com/markets/stocks/live-markets-fed-sends-europes-tech-check-out-bears-2022-01-27/,"Jan 27 - Welcome to the home for real-time coverage of markets brought to you by Reuters reporters. You can share your thoughts with us at markets.research@thomsonreuters.com
FED SENDS EUROPE'S TECH… [+4984 chars]",0,0.822,0.178,0.6369,1,0,1,0
560,The U.S. consumer sentiment takes a hit in early February from the rising concerns over surging inflationary levels.,2022-02-15T21:00:00Z,http://www.zacks.com/stock/news/1868061/us-consumer-sentiment-slips-in-february-will-etfs-suffer?cid=CS-ENTREPRENEUR-FT-etf_news_and_commentary-1868061,U.S. consumers are feeling the heat of the continuously rising inflation levels. The latest disappointing preliminary consumer sentiment readings for early February that have slipped to the lowest le… [+6765 chars],0,1,0,0,0,-1,1,0
561,"Analysis: some want Bank to play catchup on rates; others say it risks engineering conditions for a recessionThe Bank of England is facing fierce criticism from both sides over its plans to raise interest rates. For hawkish economists, Threadneedle Street has…",2022-02-15T06:00:04Z,https://amp.theguardian.com/business/2022/feb/15/credibility-challenge-bank-of-england-walks-a-tightrope-on-interest-rates,"The Bank of England is facing fierce criticism from both sides over its plans to raise interest rates. For hawkish economists, Threadneedle Street has fallen badly behind the curve, miscalculating th… [+7564 chars]",0.107,0.749,0.143,0.1779,1,1,1,0
562,A look at the day ahead in markets from Sujata Rao,2022-02-10T08:11:00Z,https://www.reuters.com/markets/europe/pause-breath-2022-02-10/,"A look at the day ahead in markets from Sujata Rao
Markets are enjoying a respite of sorts. With 10-year Treasury yields down five basis points from recent highs, the Nasdaq has managed to rebound a… [+2308 chars]",0,1,0,0,0,0,0,0
563,"Welcome to the home for real-time coverage of markets brought to you by Reuters reporters. You can share your thoughts with us at <a href=""mailto:markets.research@thomsonreuters.com"" target=""_blank"">markets.research@thomsonreuters.com</a>",2022-02-10T12:53:00Z,https://www.reuters.com/markets/stocks/live-markets-us-cpi-what-about-dollar-bonds-2022-02-10/,"Feb 10 - Welcome to the home for real-time coverage of markets brought to you by Reuters reporters. You can share your thoughts with us at markets.research@thomsonreuters.com
U.S. CPI: WHAT ABOUT DO… [+10336 chars]",0,0.822,0.178,0.6369,1,0,1,0
564,"Welcome to the home for real-time coverage of markets brought to you by Reuters reporters. You can share your thoughts with us at <a href=""mailto:markets.research@thomsonreuters.com"" target=""_blank"">markets.research@thomsonreuters.com</a>",2022-02-10T12:19:00Z,https://www.reuters.com/markets/stocks/live-markets-options-market-sceptical-ahead-cpi-data-2022-02-10/,"Feb 10 - Welcome to the home for real-time coverage of markets brought to you by Reuters reporters. You can share your thoughts with us at markets.research@thomsonreuters.com
OPTIONS MARKET SCEPTICA… [+9001 chars]",0,0.822,0.178,0.6369,1,0,1,0
565,"A touch reluctantly maybe, but the world's big central banks seem to be leaning toward a short, sharp policy squeeze now in the hope they can back off quickly once they've made that mark.",2022-02-04T09:35:00Z,https://www.reuters.com/markets/europe/central-banks-gamble-short-sharp-shock-2022-02-04/,"LONDON, Feb 4 (Reuters) - A touch reluctantly maybe, but the world's big central banks seem to be leaning toward a short, sharp policy squeeze now in the hope they can back off quickly once they've m… [+5612 chars]",0.034,0.856,0.11,0.5647,1,1,1,0
566,"US warns Russia could exploit Volodymyr Zelenskiy’s absence to topple him before return to KyivThe Ukrainian president, Volodymyr Zelenskiy, is set to deliver a rallying call to the west to save his country from a Russian invasion when he plans to address a s…",2022-02-19T09:25:21Z,https://amp.theguardian.com/world/2022/feb/19/ukrainian-president-munich-conference-russia-volodymyr-zelenskiy,"The Ukrainian president, Volodymyr Zelenskiy, is set to deliver a rallying call to the west to save his country from a Russian invasion when he plans to address a security conference in Munich on Sat… [+5080 chars]",0.064,0.864,0.073,0.34,1,1,1,0
567,"Welcome to the home for real-time coverage of markets brought to you by Reuters reporters. You can share your thoughts with us at <a href=""mailto:markets.research@thomsonreuters.com"" target=""_blank"">markets.research@thomsonreuters.com</a>",2022-01-26T17:15:00Z,https://www.reuters.com/markets/asia/live-markets-just-do-it-already-fed-2022-01-26/,"Jan 26 - Welcome to the home for real-time coverage of markets brought to you by Reuters reporters. You can share your thoughts with us at markets.research@thomsonreuters.com
JUST DO IT ALREADY FED … [+9399 chars]",0,0.822,0.178,0.6369,1,0,1,0
568,"Welcome to the home for real-time coverage of markets brought to you by Reuters reporters. You can share your thoughts with us at <a href=""mailto:markets.research@thomsonreuters.com"" target=""_blank"">markets.research@thomsonreuters.com</a>",2022-02-10T21:36:00Z,https://www.reuters.com/markets/asia/live-markets-cpi-spooks-yields-jump-stocks-sink-2022-02-10/,"Feb 10 - Welcome to the home for real-time coverage of markets brought to you by Reuters reporters. You can share your thoughts with us at markets.research@thomsonreuters.com
CPI SPOOKS, YIELDS JUMP… [+13124 chars]",0,0.822,0.178,0.6369,1,0,1,0
